startDate,endDate,startTime,endTime,duration,activity,location,
11/1/17, 2017-11-01 09:55:14, 2017-11-01 01:28:40 GMT-3, 2017-11-01 06:55:14 GMT-3,5.44, Sleep, , 
11/1/17, 2017-11-02 13:48:56, 2017-11-01 12:55:58 CDT, 2017-11-02 08:48:56 CDT,19.88, Home, Home, 
11/2/17, 2017-11-02 09:55:13, 2017-11-01 22:40:20 CDT, 2017-11-02 04:55:13 CDT,6.25, Sleep, Home, 
11/2/17, 2017-11-02 14:10:37, 2017-11-02 08:48:55 CDT, 2017-11-02 09:10:37 CDT,0.36, Commute to work, , 
11/2/17, 2017-11-02 13:51:45, 2017-11-02 08:48:56 CDT, 2017-11-02 08:51:45 CDT,0.05, Walk, , 
11/2/17, 2017-11-02 14:06:10, 2017-11-02 08:54:02 CDT, 2017-11-02 09:06:10 CDT,0.2, Transport, , 
11/2/17, 2017-11-02 14:10:36, 2017-11-02 09:06:10 CDT, 2017-11-02 09:10:36 CDT,0.07, Walk, , 
11/2/17, 2017-11-02 20:59:31, 2017-11-02 09:10:37 CDT, 2017-11-02 15:59:31 CDT,6.82, School, Oakton Community College RHC Campus Art Room, 
11/2/17, 2017-11-02 21:27:45, 2017-11-02 15:59:30 CDT, 2017-11-02 16:27:45 CDT,0.47, Commute to home, , 
11/2/17, 2017-11-02 21:06:43, 2017-11-02 15:59:31 CDT, 2017-11-02 16:06:43 CDT,0.12, Walk, , 
11/2/17, 2017-11-02 21:26:56, 2017-11-02 16:06:44 CDT, 2017-11-02 16:26:56 CDT,0.34, Transport, , 
11/2/17, 2017-11-03 11:30:00, 2017-11-02 16:27:45 CDT, 2017-11-03 06:30:00 CDT,14.04, Home, Home, 
11/3/17, 2017-11-03 11:23:31, 2017-11-02 23:11:51 CDT, 2017-11-03 06:23:31 CDT,7.19, Sleep, Home, 
11/3/17, 2017-11-03 16:57:21, 2017-11-03 06:30:45 CDT, 2017-11-03 11:57:21 CDT,5.44, Work, Bagel Art, 
11/3/17, 2017-11-03 17:12:55, 2017-11-03 11:57:21 CDT, 2017-11-03 12:12:55 CDT,0.26, Transport, , 
11/3/17, 2017-11-04 01:09:45, 2017-11-03 12:12:55 CDT, 2017-11-03 20:09:45 CDT,7.95, Work, Home, 
11/4/17, 2017-11-04 01:26:11, 2017-11-03 20:09:44 CDT, 2017-11-03 20:26:11 CDT,0.27, Commute to home, , 
11/4/17, 2017-11-04 01:26:10, 2017-11-03 20:09:45 CDT, 2017-11-03 20:26:10 CDT,0.27, Walk, , 
11/4/17, 2017-11-04 11:28:32, 2017-11-03 20:26:11 CDT, 2017-11-04 06:28:32 CDT,10.04, Home, Home, 
11/4/17, 2017-11-04 10:50:06, 2017-11-03 23:00:44 CDT, 2017-11-04 05:50:06 CDT,6.82, Sleep, Home, 
11/4/17, 2017-11-04 20:42:14, 2017-11-04 06:29:17 CDT, 2017-11-04 15:42:14 CDT,9.22, Work, Bagel Art, 
11/4/17, 2017-11-04 20:49:39, 2017-11-04 15:42:32 CDT, 2017-11-04 15:49:39 CDT,0.12, Home, Home, 
11/5/17, 2017-11-05 11:50:09, 2017-11-04 22:36:48 CDT, 2017-11-05 05:50:09 CST,8.22, Sleep, Home, 
11/6/17, 2017-11-06 11:23:15, 2017-11-05 21:34:12 CST, 2017-11-06 05:23:15 CST,7.82, Sleep, Home, 
11/6/17, 2017-11-06 18:46:02, 2017-11-06 12:03:59 CST, 2017-11-06 12:46:02 CST,0.7, Transport, , 
11/6/17, 2017-11-06 19:05:17, 2017-11-06 12:46:02 CST, 2017-11-06 13:05:17 CST,0.32, Walk, , 
11/6/17, 2017-11-06 22:11:06, 2017-11-06 16:04:22 CST, 2017-11-06 16:11:06 CST,0.11, Walk, , 
11/6/17, 2017-11-06 22:18:56, 2017-11-06 16:11:07 CST, 2017-11-06 16:18:56 CST,0.13, Transport, , 
11/6/17, 2017-11-06 23:07:30, 2017-11-06 17:02:42 CST, 2017-11-06 17:07:30 CST,0.08, Walk, , 
11/6/17, 2017-11-06 23:21:33, 2017-11-06 17:19:06 CST, 2017-11-06 17:21:33 CST,0.04, Walk, , 
11/7/17, 2017-11-07 01:35:53, 2017-11-06 19:02:04 CST, 2017-11-06 19:35:53 CST,0.56, Walk, , 
11/7/17, 2017-11-07 05:22:10, 2017-11-06 19:56:43 CST, 2017-11-06 23:22:10 CST,3.42, Dinner, Ludvig’s, 
11/7/17, 2017-11-07 05:42:03, 2017-11-06 23:22:10 CST, 2017-11-06 23:42:03 CST,0.33, Transport, , 
11/7/17, 2017-11-07 05:44:45, 2017-11-06 23:42:03 CST, 2017-11-06 23:44:45 CST,0.05, Walk, , 
11/7/17, 2017-11-07 14:52:55, 2017-11-06 23:44:46 CST, 2017-11-07 08:52:55 CST,9.14, Home, Home, 
11/7/17, 2017-11-07 12:40:35, 2017-11-07 00:23:30 CST, 2017-11-07 06:40:35 CST,6.28, Sleep, Home, 
11/7/17, 2017-11-07 15:10:00, 2017-11-07 08:52:55 CST, 2017-11-07 09:10:00 CST,0.28, Transport, , 
11/7/17, 2017-11-07 15:15:33, 2017-11-07 09:10:00 CST, 2017-11-07 09:15:33 CST,0.09, Walk, , 
11/7/17, 2017-11-07 22:30:40, 2017-11-07 16:21:16 CST, 2017-11-07 16:30:40 CST,0.16, Walk, , 
11/7/17, 2017-11-07 23:03:25, 2017-11-07 16:42:59 CST, 2017-11-07 17:03:25 CST,0.34, Transport, , 
11/7/17, 2017-11-08 12:27:15, 2017-11-07 17:03:31 CST, 2017-11-08 06:27:15 CST,13.4, Home, Home, 
11/8/17, 2017-11-08 11:54:54, 2017-11-07 22:40:39 CST, 2017-11-08 05:54:54 CST,7.24, Sleep, Home, 
11/8/17, 2017-11-08 22:08:35, 2017-11-08 06:28:01 CST, 2017-11-08 16:08:35 CST,9.68, Work, Bagel Art, 
11/8/17, 2017-11-08 22:10:42, 2017-11-08 16:08:34 CST, 2017-11-08 16:10:42 CST,0.04, Commute to home, , 
11/8/17, 2017-11-08 22:34:36, 2017-11-08 16:10:42 CST, 2017-11-08 16:34:36 CST,0.4, Home, Home, 
11/8/17, 2017-11-08 22:49:16, 2017-11-08 16:34:36 CST, 2017-11-08 16:49:16 CST,0.24, Walk, , 
11/8/17, 2017-11-08 22:55:17, 2017-11-08 16:49:17 CST, 2017-11-08 16:55:17 CST,0.1, Cycle, , 
11/8/17, 2017-11-09 14:49:30, 2017-11-08 16:55:17 CST, 2017-11-09 08:49:30 CST,15.9, Home, Home, 
11/9/17, 2017-11-09 12:00:06, 2017-11-08 22:24:15 CST, 2017-11-09 06:00:06 CST,7.6, Sleep, Home, 
11/9/17, 2017-11-09 15:10:27, 2017-11-09 08:54:03 CST, 2017-11-09 09:10:27 CST,0.27, Transport, , 
11/9/17, 2017-11-09 15:14:18, 2017-11-09 09:10:27 CST, 2017-11-09 09:14:18 CST,0.06, Walk, , 
11/9/17, 2017-11-09 22:32:31, 2017-11-09 16:23:53 CST, 2017-11-09 16:32:31 CST,0.14, Walk, , 
11/9/17, 2017-11-09 22:39:52, 2017-11-09 16:33:43 CST, 2017-11-09 16:39:52 CST,0.1, Transport, , 
11/9/17, 2017-11-09 22:53:24, 2017-11-09 16:48:14 CST, 2017-11-09 16:53:24 CST,0.09, Transport, , 
11/9/17, 2017-11-09 23:11:43, 2017-11-09 16:53:24 CST, 2017-11-09 17:11:43 CST,0.31, Home, Home, 
11/9/17, 2017-11-09 23:52:44, 2017-11-09 17:12:24 CST, 2017-11-09 17:52:44 CST,0.67, Transport, , 
11/10/17, 2017-11-10 01:47:46, 2017-11-09 19:37:48 CST, 2017-11-09 19:47:46 CST,0.17, Walk, , 
11/10/17, 2017-11-10 02:26:08, 2017-11-09 19:47:47 CST, 2017-11-09 20:26:08 CST,0.64, Transport, , 
11/10/17, 2017-11-10 12:08:56, 2017-11-09 22:34:50 CST, 2017-11-10 06:08:56 CST,7.57, Sleep, Home, 
11/10/17, 2017-11-10 12:29:36, 2017-11-10 05:30:51 CST, 2017-11-10 06:29:36 CST,0.98, Home, Home, 
11/10/17, 2017-11-10 12:32:10, 2017-11-10 06:29:36 CST, 2017-11-10 06:32:10 CST,0.04, Walk, , 
11/10/17, 2017-11-10 13:24:32, 2017-11-10 07:14:41 CST, 2017-11-10 07:24:32 CST,0.16, Walk, , 
11/10/17, 2017-11-10 18:27:41, 2017-11-10 12:19:55 CST, 2017-11-10 12:27:41 CST,0.13, Walk, , 
11/10/17, 2017-11-10 19:37:50, 2017-11-10 13:31:26 CST, 2017-11-10 13:37:50 CST,0.11, Walk, , 
11/10/17, 2017-11-10 19:56:04, 2017-11-10 13:46:19 CST, 2017-11-10 13:56:04 CST,0.16, Walk, , 
11/10/17, 2017-11-10 20:31:38, 2017-11-10 14:13:04 CST, 2017-11-10 14:31:38 CST,0.31, Walk, , 
11/10/17, 2017-11-10 22:43:08, 2017-11-10 16:31:50 CST, 2017-11-10 16:43:08 CST,0.19, Walk, , 
11/11/17, 2017-11-11 12:23:05, 2017-11-10 21:11:01 CST, 2017-11-11 06:23:05 CST,9.2, Home, Home, 
11/11/17, 2017-11-11 11:50:04, 2017-11-10 22:32:35 CST, 2017-11-11 05:50:04 CST,7.29, Sleep, Home, 
11/11/17, 2017-11-11 17:47:28, 2017-11-11 06:23:50 CST, 2017-11-11 11:47:28 CST,5.39, Work, Bagel Art, 
11/12/17, 2017-11-12 12:00:13, 2017-11-11 23:13:54 CST, 2017-11-12 06:00:13 CST,6.77, Sleep, Home, 
11/13/17, 2017-11-13 12:36:31, 2017-11-12 23:49:36 CST, 2017-11-13 06:36:31 CST,6.78, Sleep, Home, 
11/13/17, 2017-11-13 19:31:16, 2017-11-13 12:42:30 CST, 2017-11-13 13:31:16 CST,0.81, Transport, , 
11/13/17, 2017-11-13 19:56:32, 2017-11-13 13:50:52 CST, 2017-11-13 13:56:32 CST,0.09, Walk, , 
11/13/17, 2017-11-13 22:23:24, 2017-11-13 13:56:33 CST, 2017-11-13 16:23:24 CST,2.45, Lunch, , 
11/13/17, 2017-11-13 22:33:45, 2017-11-13 16:23:24 CST, 2017-11-13 16:33:45 CST,0.17, Walk, , 
11/13/17, 2017-11-13 23:34:58, 2017-11-13 16:54:06 CST, 2017-11-13 17:34:58 CST,0.68, Transport, , 
11/14/17, 2017-11-14 13:00:13, 2017-11-14 00:19:04 CST, 2017-11-14 07:00:13 CST,6.69, Sleep, Home, 
11/14/17, 2017-11-14 14:41:58, 2017-11-14 08:28:26 CST, 2017-11-14 08:41:58 CST,0.23, Transport, , 
11/14/17, 2017-11-14 14:46:09, 2017-11-14 08:41:58 CST, 2017-11-14 08:46:09 CST,0.07, Walk, , 
11/14/17, 2017-11-14 22:12:22, 2017-11-14 16:07:10 CST, 2017-11-14 16:12:22 CST,0.09, Walk, , 
11/14/17, 2017-11-14 22:19:10, 2017-11-14 16:13:17 CST, 2017-11-14 16:19:10 CST,0.1, Transport, , 
11/14/17, 2017-11-14 22:38:08, 2017-11-14 16:34:46 CST, 2017-11-14 16:38:08 CST,0.06, Transport, , 
11/14/17, 2017-11-15 12:23:24, 2017-11-14 16:39:27 CST, 2017-11-15 06:23:24 CST,13.73, Home, Home, 
11/15/17, 2017-11-15 12:13:07, 2017-11-14 22:19:32 CST, 2017-11-15 06:13:07 CST,7.89, Sleep, Home, 
11/15/17, 2017-11-15 18:05:33, 2017-11-15 06:24:07 CST, 2017-11-15 12:05:33 CST,5.69, Work, Bagel Art, 
11/15/17, 2017-11-16 14:33:22, 2017-11-15 12:06:10 CST, 2017-11-16 08:33:22 CST,20.45, Home, Home, 
11/16/17, 2017-11-16 09:14:41, 2017-11-15 22:18:54 CST, 2017-11-16 03:14:41 CST,4.93, Sleep, Home, 
11/16/17, 2017-11-16 14:40:48, 2017-11-16 08:33:47 CST, 2017-11-16 08:40:48 CST,0.12, Work, Bagel Art, 
11/16/17, 2017-11-16 14:47:23, 2017-11-16 08:40:48 CST, 2017-11-16 08:47:23 CST,0.11, Transport, , 
11/16/17, 2017-11-16 15:04:08, 2017-11-16 08:59:04 CST, 2017-11-16 09:04:08 CST,0.08, Transport, , 
11/16/17, 2017-11-16 15:11:32, 2017-11-16 09:04:08 CST, 2017-11-16 09:11:32 CST,0.12, Walk, , 
11/16/17, 2017-11-16 22:07:35, 2017-11-16 15:59:55 CST, 2017-11-16 16:07:35 CST,0.13, Walk, , 
11/16/17, 2017-11-16 22:21:26, 2017-11-16 16:14:30 CST, 2017-11-16 16:21:26 CST,0.12, Transport, , 
11/16/17, 2017-11-17 02:17:29, 2017-11-16 16:43:17 CST, 2017-11-16 20:17:29 CST,3.57, Home, Home, 
11/17/17, 2017-11-17 02:23:21, 2017-11-16 20:17:29 CST, 2017-11-16 20:23:21 CST,0.1, Walk, , 
11/17/17, 2017-11-17 04:16:24, 2017-11-16 20:24:10 CST, 2017-11-16 22:16:24 CST,1.87, Coffee, Other Brother Coffeehouse, 
11/17/17, 2017-11-17 12:25:52, 2017-11-16 23:08:29 CST, 2017-11-17 06:25:52 CST,7.29, Work, Home, 
11/17/17, 2017-11-17 11:22:20, 2017-11-16 23:09:12 CST, 2017-11-17 05:22:20 CST,6.22, Sleep, Home, 
11/17/17, 2017-11-17 19:04:23, 2017-11-17 06:26:37 CST, 2017-11-17 13:04:23 CST,6.63, Work, Bagel Art, 
11/18/17, 2017-11-18 01:36:22, 2017-11-17 18:52:05 CST, 2017-11-17 19:36:22 CST,0.74, Transport, , 
11/18/17, 2017-11-18 03:22:05, 2017-11-17 20:53:42 CST, 2017-11-17 21:22:05 CST,0.47, Transport, , 
11/18/17, 2017-11-18 03:53:14, 2017-11-17 21:22:05 CST, 2017-11-17 21:53:14 CST,0.52, Home, Home, 
11/18/17, 2017-11-18 04:01:19, 2017-11-17 21:53:14 CST, 2017-11-17 22:01:19 CST,0.13, Walk, , 
11/18/17, 2017-11-18 13:27:34, 2017-11-17 22:01:20 CST, 2017-11-18 07:27:34 CST,9.44, Home, Home, 
11/18/17, 2017-11-18 12:25:16, 2017-11-17 23:01:54 CST, 2017-11-18 06:25:16 CST,7.39, Sleep, Home, 
11/18/17, 2017-11-18 22:02:27, 2017-11-18 07:28:13 CST, 2017-11-18 16:02:27 CST,8.57, Work, Bagel Art, 
11/18/17, 2017-11-19 00:47:46, 2017-11-18 16:02:58 CST, 2017-11-18 18:47:46 CST,2.75, Home, Home, 
11/19/17, 2017-11-19 01:05:17, 2017-11-18 18:47:46 CST, 2017-11-18 19:05:17 CST,0.29, Walk, , 
11/19/17, 2017-11-19 12:27:22, 2017-11-18 19:05:18 CST, 2017-11-19 06:27:22 CST,11.37, Home, Home, 
11/19/17, 2017-11-19 11:50:04, 2017-11-18 22:32:03 CST, 2017-11-19 05:50:04 CST,7.3, Sleep, Home, 
11/19/17, 2017-11-19 19:13:27, 2017-11-19 06:27:55 CST, 2017-11-19 13:13:27 CST,6.76, Work, Bagel Art, 
11/19/17, 2017-11-19 22:11:02, 2017-11-19 13:13:46 CST, 2017-11-19 16:11:02 CST,2.95, Home, Home, 
11/19/17, 2017-11-19 22:28:45, 2017-11-19 16:11:02 CST, 2017-11-19 16:28:45 CST,0.3, Walk, , 
11/19/17, 2017-11-19 22:49:20, 2017-11-19 16:36:33 CST, 2017-11-19 16:49:20 CST,0.21, Walk, , 
11/19/17, 2017-11-20 04:00:47, 2017-11-19 16:49:21 CST, 2017-11-19 22:00:47 CST,5.19, Friends, Melissa’s, 
11/20/17, 2017-11-20 04:06:45, 2017-11-19 22:00:47 CST, 2017-11-19 22:06:45 CST,0.1, Cycle, , 
11/20/17, 2017-11-20 12:28:49, 2017-11-19 22:06:45 CST, 2017-11-20 06:28:49 CST,8.37, Home, Home, 
11/20/17, 2017-11-20 11:44:56, 2017-11-19 22:58:55 CST, 2017-11-20 05:44:56 CST,6.77, Sleep, Home, 
11/20/17, 2017-11-21 16:29:45, 2017-11-20 06:29:34 CST, 2017-11-21 10:29:45 CST,28, Home, Home, 
11/20/17, 2017-11-20 23:30:45, 2017-11-20 06:29:34 CST, 2017-11-20 17:30:45 CST,11.02, Work, Home, 
11/21/17, 2017-11-21 11:30:41, 2017-11-20 22:48:35 CST, 2017-11-21 05:30:41 CST,6.7, Sleep, Home, 
11/21/17, 2017-11-21 16:35:36, 2017-11-21 10:30:31 CST, 2017-11-21 10:35:36 CST,0.08, Transport, , 
11/21/17, 2017-11-21 16:57:04, 2017-11-21 10:51:48 CST, 2017-11-21 10:57:04 CST,0.09, Transport, , 
11/21/17, 2017-11-21 17:00:13, 2017-11-21 10:57:04 CST, 2017-11-21 11:00:13 CST,0.05, Walk, , 
11/21/17, 2017-11-21 22:07:13, 2017-11-21 16:01:06 CST, 2017-11-21 16:07:13 CST,0.1, Walk, , 
11/21/17, 2017-11-21 22:19:54, 2017-11-21 16:13:14 CST, 2017-11-21 16:19:54 CST,0.11, Transport, , 
11/21/17, 2017-11-21 22:31:02, 2017-11-21 16:28:39 CST, 2017-11-21 16:31:02 CST,0.04, Transport, , 
11/21/17, 2017-11-22 12:27:37, 2017-11-21 16:31:02 CST, 2017-11-22 06:27:37 CST,13.94, Home, Home, 
11/22/17, 2017-11-22 11:21:57, 2017-11-21 23:51:25 CST, 2017-11-22 05:21:57 CST,5.51, Sleep, Home, 
11/22/17, 2017-11-22 19:18:12, 2017-11-22 06:28:22 CST, 2017-11-22 13:18:12 CST,6.83, Work, Bagel Art, 
11/22/17, 2017-11-23 15:40:34, 2017-11-22 13:18:18 CST, 2017-11-23 09:40:34 CST,20.37, Home, Home, 
11/23/17, 2017-11-23 14:10:56, 2017-11-22 22:29:44 CST, 2017-11-23 08:10:56 CST,9.69, Sleep, Home, 
11/23/17, 2017-11-23 20:15:50, 2017-11-23 09:40:34 CST, 2017-11-23 14:15:50 CST,4.59, Home, Home, 
11/23/17, 2017-11-23 20:48:18, 2017-11-23 14:15:50 CST, 2017-11-23 14:48:18 CST,0.54, Walk, , 
11/23/17, 2017-11-23 21:34:14, 2017-11-23 14:48:19 CST, 2017-11-23 15:34:14 CST,0.77, Groceries, Jewel-Osco, 
11/23/17, 2017-11-24 11:27:20, 2017-11-23 15:35:42 CST, 2017-11-24 05:27:20 CST,13.86, Home, Home, 
11/24/17, 2017-11-24 10:58:53, 2017-11-23 23:35:52 CST, 2017-11-24 04:58:53 CST,5.38, Sleep, Home, 
11/24/17, 2017-11-24 17:53:21, 2017-11-24 05:28:05 CST, 2017-11-24 11:53:21 CST,6.42, Work, Bagel Art, 
11/24/17, 2017-11-24 21:13:42, 2017-11-24 11:54:06 CST, 2017-11-24 15:13:42 CST,3.33, Work, Bagel Art, 
11/24/17, 2017-11-24 22:53:36, 2017-11-24 15:13:41 CST, 2017-11-24 16:53:36 CST,1.67, Commute to home, , 
11/24/17, 2017-11-24 21:24:56, 2017-11-24 15:13:42 CST, 2017-11-24 15:24:56 CST,0.19, Walk, , 
11/24/17, 2017-11-24 22:03:00, 2017-11-24 15:24:57 CST, 2017-11-24 16:03:00 CST,0.63, Shopping, CVS/pharmacy, 
11/24/17, 2017-11-24 22:09:22, 2017-11-24 16:03:00 CST, 2017-11-24 16:09:22 CST,0.11, Transport, , 
11/24/17, 2017-11-24 22:22:25, 2017-11-24 16:11:36 CST, 2017-11-24 16:22:25 CST,0.18, Walk, , 
11/24/17, 2017-11-24 22:40:12, 2017-11-24 16:25:13 CST, 2017-11-24 16:40:12 CST,0.25, Walk, , 
11/24/17, 2017-11-24 22:53:36, 2017-11-24 16:42:01 CST, 2017-11-24 16:53:36 CST,0.19, Transport, , 
11/24/17, 2017-11-25 12:23:16, 2017-11-24 16:53:36 CST, 2017-11-25 06:23:16 CST,13.49, Home, Home, 
11/25/17, 2017-11-25 11:23:32, 2017-11-24 20:36:02 CST, 2017-11-25 05:23:32 CST,8.79, Sleep, Home, 
11/25/17, 2017-11-25 18:14:57, 2017-11-25 06:24:01 CST, 2017-11-25 12:14:57 CST,5.85, Work, Bagel Art, 
11/25/17, 2017-11-25 18:20:39, 2017-11-25 12:14:57 CST, 2017-11-25 12:20:39 CST,0.1, Walk, , 
11/25/17, 2017-11-25 19:00:23, 2017-11-25 12:32:30 CST, 2017-11-25 13:00:23 CST,0.46, Coffee, Other Brother Coffeehouse, 
11/25/17, 2017-11-25 22:44:48, 2017-11-25 13:01:08 CST, 2017-11-25 16:44:48 CST,3.73, Work, Home, 
11/25/17, 2017-11-25 22:51:00, 2017-11-25 16:44:48 CST, 2017-11-25 16:51:00 CST,0.1, Walk, , 
11/25/17, 2017-11-25 23:23:22, 2017-11-25 17:05:45 CST, 2017-11-25 17:23:22 CST,0.29, Transport, , 
11/25/17, 2017-11-25 23:36:56, 2017-11-25 17:23:22 CST, 2017-11-25 17:36:56 CST,0.23, Walk, , 
11/25/17, 2017-11-26 00:53:32, 2017-11-25 17:36:57 CST, 2017-11-25 18:53:32 CST,1.28, Dinner, Oiistar, 
11/26/17, 2017-11-26 01:44:17, 2017-11-25 19:17:07 CST, 2017-11-25 19:44:17 CST,0.45, Walk, , 
11/26/17, 2017-11-26 01:58:16, 2017-11-25 19:44:18 CST, 2017-11-25 19:58:16 CST,0.23, Transport, , 
11/26/17, 2017-11-26 02:11:40, 2017-11-25 19:58:16 CST, 2017-11-25 20:11:40 CST,0.22, Walk, , 
11/26/17, 2017-11-26 12:52:15, 2017-11-25 20:11:41 CST, 2017-11-26 06:52:15 CST,10.68, Home, Home, 
11/26/17, 2017-11-26 12:30:44, 2017-11-25 22:09:01 CST, 2017-11-26 06:30:44 CST,8.36, Sleep, Home, 
11/26/17, 2017-11-26 15:25:51, 2017-11-26 06:53:00 CST, 2017-11-26 09:25:51 CST,2.55, Work, Bagel Art, 
11/26/17, 2017-11-26 15:36:42, 2017-11-26 09:25:51 CST, 2017-11-26 09:36:42 CST,0.18, Walk, , 
11/26/17, 2017-11-26 16:12:12, 2017-11-26 09:47:28 CST, 2017-11-26 10:12:12 CST,0.41, Transport, , 
11/26/17, 2017-11-26 17:00:27, 2017-11-26 10:12:12 CST, 2017-11-26 11:00:27 CST,0.8, Walk, , 
11/26/17, 2017-11-26 18:47:35, 2017-11-26 12:42:49 CST, 2017-11-26 12:47:35 CST,0.08, Walk, , 
11/26/17, 2017-11-26 21:29:38, 2017-11-26 15:22:37 CST, 2017-11-26 15:29:38 CST,0.12, Walk, , 
11/26/17, 2017-11-26 22:20:09, 2017-11-26 15:57:54 CST, 2017-11-26 16:20:09 CST,0.37, Transport, , 
11/26/17, 2017-11-27 12:25:33, 2017-11-26 16:22:02 CST, 2017-11-27 06:25:33 CST,14.06, Home, Home, 
11/27/17, 2017-11-27 11:52:51, 2017-11-26 22:53:39 CST, 2017-11-27 05:52:51 CST,6.99, Sleep, Home, 
11/27/17, 2017-11-27 12:26:57, 2017-11-27 06:25:32 CST, 2017-11-27 06:26:57 CST,0.02, Commute to work, , 
11/27/17, 2017-11-27 21:53:28, 2017-11-27 06:26:57 CST, 2017-11-27 15:53:28 CST,9.44, Work, Bagel Art, 
11/27/17, 2017-11-27 22:04:57, 2017-11-27 15:53:53 CST, 2017-11-27 16:04:57 CST,0.18, Home, Home, 
11/27/17, 2017-11-27 22:11:40, 2017-11-27 16:04:57 CST, 2017-11-27 16:11:40 CST,0.11, Walk, , 
11/27/17, 2017-11-27 23:45:56, 2017-11-27 16:11:41 CST, 2017-11-27 17:45:56 CST,1.57, Shopping, Urban Outfitters, 
11/27/17, 2017-11-28 01:04:06, 2017-11-27 17:46:41 CST, 2017-11-27 19:04:06 CST,1.29, Shopping, CVS/pharmacy, 
11/28/17, 2017-11-28 01:10:07, 2017-11-27 19:04:06 CST, 2017-11-27 19:10:07 CST,0.1, Walk, , 
11/28/17, 2017-11-28 14:56:10, 2017-11-27 19:10:08 CST, 2017-11-28 08:56:10 CST,13.77, Home, , 
11/28/17, 2017-11-28 12:15:10, 2017-11-27 22:47:56 CST, 2017-11-28 06:15:10 CST,7.45, Sleep, , 
11/28/17, 2017-11-28 15:09:54, 2017-11-28 08:56:10 CST, 2017-11-28 09:09:54 CST,0.23, Transport, , 
11/28/17, 2017-11-28 15:15:08, 2017-11-28 09:09:54 CST, 2017-11-28 09:15:08 CST,0.09, Walk, , 
11/28/17, 2017-11-28 22:17:46, 2017-11-28 16:09:39 CST, 2017-11-28 16:17:46 CST,0.14, Walk, , 
11/28/17, 2017-11-28 22:29:39, 2017-11-28 16:24:49 CST, 2017-11-28 16:29:39 CST,0.08, Transport, , 
11/28/17, 2017-11-28 22:41:01, 2017-11-28 16:37:24 CST, 2017-11-28 16:41:01 CST,0.06, Transport, , 
11/28/17, 2017-11-29 00:07:48, 2017-11-28 16:41:01 CST, 2017-11-28 18:07:48 CST,1.45, Home, Home, 
11/29/17, 2017-11-29 00:13:49, 2017-11-28 18:07:48 CST, 2017-11-28 18:13:49 CST,0.1, Walk, , 
11/29/17, 2017-11-29 01:26:04, 2017-11-28 19:15:33 CST, 2017-11-28 19:26:04 CST,0.18, Walk, , 
11/29/17, 2017-11-29 11:28:53, 2017-11-28 19:26:05 CST, 2017-11-29 05:28:53 CST,10.05, Work, Home, 
11/29/17, 2017-11-29 10:58:55, 2017-11-28 21:03:46 CST, 2017-11-29 04:58:55 CST,7.92, Sleep, Home, 
11/29/17, 2017-11-29 11:30:47, 2017-11-29 05:28:52 CST, 2017-11-29 05:30:47 CST,0.03, Commute to work, , 
11/29/17, 2017-11-29 19:23:45, 2017-11-29 05:30:47 CST, 2017-11-29 13:23:45 CST,7.88, Work, Bagel Art, 
11/29/17, 2017-11-29 19:25:45, 2017-11-29 13:23:44 CST, 2017-11-29 13:25:45 CST,0.03, Commute to home, , 
11/29/17, 2017-11-29 20:12:28, 2017-11-29 13:25:45 CST, 2017-11-29 14:12:28 CST,0.78, Home, Home, 
11/29/17, 2017-11-29 20:22:11, 2017-11-29 14:12:28 CST, 2017-11-29 14:22:11 CST,0.16, Walk, , 
11/29/17, 2017-11-29 20:33:11, 2017-11-29 14:22:12 CST, 2017-11-29 14:33:11 CST,0.18, Transport, CTA - Main, 
11/29/17, 2017-11-29 20:45:02, 2017-11-29 14:34:05 CST, 2017-11-29 14:45:02 CST,0.18, Transport, , 
11/29/17, 2017-11-29 22:58:33, 2017-11-29 14:45:02 CST, 2017-11-29 16:58:33 CST,2.23, Shopping, T.J. Maxx, 
11/29/17, 2017-11-29 23:14:48, 2017-11-29 16:58:33 CST, 2017-11-29 17:14:48 CST,0.27, Transport, , 
11/29/17, 2017-11-29 23:39:46, 2017-11-29 17:23:49 CST, 2017-11-29 17:39:46 CST,0.27, Home, Home, 
11/29/17, 2017-11-30 00:02:40, 2017-11-29 17:39:46 CST, 2017-11-29 18:02:40 CST,0.38, Walk, , 
11/30/17, 2017-11-30 14:49:59, 2017-11-29 18:02:41 CST, 2017-11-30 08:49:59 CST,14.79, Work, Home, 
11/30/17, 2017-11-30 13:45:23, 2017-11-30 01:36:04 CST, 2017-11-30 07:45:23 CST,6.16, Sleep, Home, 
11/30/17, 2017-11-30 14:56:50, 2017-11-30 08:50:44 CST, 2017-11-30 08:56:50 CST,0.1, Work, Bagel Art, 
11/30/17, 2017-11-30 15:11:58, 2017-11-30 08:57:38 CST, 2017-11-30 09:11:58 CST,0.24, Transport, , 
11/30/17, 2017-11-30 15:18:39, 2017-11-30 09:11:58 CST, 2017-11-30 09:18:39 CST,0.11, Walk, , 
11/30/17, 2017-11-30 23:19:35, 2017-11-30 17:12:27 CST, 2017-11-30 17:19:35 CST,0.12, Transport, , 
11/30/17, 2017-11-30 23:29:39, 2017-11-30 17:19:35 CST, 2017-11-30 17:29:39 CST,0.17, Walk, , 
11/30/17, 2017-12-01 01:27:32, 2017-11-30 17:29:40 CST, 2017-11-30 19:27:32 CST,1.96, Work, Home, 
12/1/17, 2017-12-01 01:39:05, 2017-11-30 19:27:32 CST, 2017-11-30 19:39:05 CST,0.19, Walk, , 
12/1/17, 2017-12-01 03:16:53, 2017-11-30 19:39:06 CST, 2017-11-30 21:16:53 CST,1.63, Dinner, Found Kitchen & Social House, 
12/1/17, 2017-12-01 03:22:52, 2017-11-30 21:16:53 CST, 2017-11-30 21:22:52 CST,0.1, Walk, , 
12/1/17, 2017-12-01 10:58:45, 2017-11-30 22:06:50 CST, 2017-12-01 04:58:45 CST,6.87, Sleep, Home, 
12/1/17, 2017-12-01 20:26:23, 2017-12-01 13:43:28 CST, 2017-12-01 14:26:23 CST,0.72, Transport, , 
12/1/17, 2017-12-01 22:32:44, 2017-12-01 14:27:29 CST, 2017-12-01 16:32:44 CST,2.09, Lunch, Happy Camper, 
12/1/17, 2017-12-01 23:08:39, 2017-12-01 16:32:44 CST, 2017-12-01 17:08:39 CST,0.6, Walk, , 
12/1/17, 2017-12-01 23:49:50, 2017-12-01 17:31:43 CST, 2017-12-01 17:49:50 CST,0.3, Walk, , 
12/1/17, 2017-12-02 00:03:08, 2017-12-01 17:55:55 CST, 2017-12-01 18:03:08 CST,0.12, Walk, , 
12/2/17, 2017-12-02 12:27:38, 2017-12-01 23:33:45 CST, 2017-12-02 06:27:38 CST,6.9, Home, Home, 
12/2/17, 2017-12-02 11:50:07, 2017-12-01 23:40:45 CST, 2017-12-02 05:50:07 CST,6.16, Sleep, Home, 
12/2/17, 2017-12-02 17:29:43, 2017-12-02 06:28:23 CST, 2017-12-02 11:29:43 CST,5.02, Work, Bagel Art, 
12/3/17, 2017-12-03 01:52:14, 2017-12-02 19:47:03 CST, 2017-12-02 19:52:14 CST,0.09, Walk, , 
12/3/17, 2017-12-03 02:12:24, 2017-12-02 19:52:15 CST, 2017-12-02 20:12:24 CST,0.34, Transport, Metra - Davis St, 
12/3/17, 2017-12-03 02:29:42, 2017-12-02 20:12:24 CST, 2017-12-02 20:29:42 CST,0.29, Transport, , 
12/3/17, 2017-12-03 02:36:55, 2017-12-02 20:29:42 CST, 2017-12-02 20:36:55 CST,0.12, Walk, , 
12/3/17, 2017-12-03 04:57:00, 2017-12-02 20:36:56 CST, 2017-12-02 22:57:00 CST,2.33, Dinner, Ludvig’s, 
12/3/17, 2017-12-03 05:04:33, 2017-12-02 22:57:00 CST, 2017-12-02 23:04:33 CST,0.13, Walk, , 
12/3/17, 2017-12-03 05:26:26, 2017-12-02 23:04:34 CST, 2017-12-02 23:26:26 CST,0.36, Transport, , 
12/3/17, 2017-12-03 05:35:34, 2017-12-02 23:26:26 CST, 2017-12-02 23:35:34 CST,0.15, Walk, , 
12/3/17, 2017-12-03 12:26:57, 2017-12-02 23:35:35 CST, 2017-12-03 06:26:57 CST,6.86, Home, Home, 
12/3/17, 2017-12-03 11:50:06, 2017-12-03 00:01:31 CST, 2017-12-03 05:50:06 CST,5.81, Sleep, Home, 
12/3/17, 2017-12-03 19:40:17, 2017-12-03 06:27:42 CST, 2017-12-03 13:40:17 CST,7.21, Work, Bagel Art, 
12/3/17, 2017-12-03 19:42:27, 2017-12-03 13:40:16 CST, 2017-12-03 13:42:27 CST,0.04, Commute to home, , 
12/3/17, 2017-12-05 14:59:20, 2017-12-03 13:42:27 CST, 2017-12-05 08:59:20 CST,43.28, Home, Home, 
12/4/17, 2017-12-04 11:50:06, 2017-12-03 22:59:40 CST, 2017-12-04 05:50:06 CST,6.84, Sleep, Home, 
12/5/17, 2017-12-05 13:30:06, 2017-12-04 23:25:12 CST, 2017-12-05 07:30:06 CST,8.08, Sleep, Home, 
12/5/17, 2017-12-05 15:11:48, 2017-12-05 08:59:20 CST, 2017-12-05 09:11:48 CST,0.21, Transport, , 
12/5/17, 2017-12-05 15:16:36, 2017-12-05 09:11:48 CST, 2017-12-05 09:16:36 CST,0.08, Walk, , 
12/5/17, 2017-12-05 22:17:11, 2017-12-05 16:10:22 CST, 2017-12-05 16:17:11 CST,0.11, Walk, , 
12/5/17, 2017-12-05 22:23:13, 2017-12-05 16:17:12 CST, 2017-12-05 16:23:13 CST,0.1, Transport, CTA - Oakton-Skokie, 
12/5/17, 2017-12-05 22:30:26, 2017-12-05 16:23:13 CST, 2017-12-05 16:30:26 CST,0.12, Transport, , 
12/5/17, 2017-12-05 22:44:31, 2017-12-05 16:38:58 CST, 2017-12-05 16:44:31 CST,0.09, Transport, , 
12/5/17, 2017-12-06 12:30:22, 2017-12-05 16:45:13 CST, 2017-12-06 06:30:22 CST,13.75, Work, Home, 
12/6/17, 2017-12-06 11:50:04, 2017-12-05 21:55:54 CST, 2017-12-06 05:50:04 CST,7.9, Sleep, Home, 
12/6/17, 2017-12-06 19:14:45, 2017-12-06 06:30:43 CST, 2017-12-06 13:14:45 CST,6.73, Work, Bagel Art, 
12/6/17, 2017-12-07 14:56:34, 2017-12-06 13:17:41 CST, 2017-12-07 08:56:34 CST,19.65, Work, Home, 
12/7/17, 2017-12-07 12:29:29, 2017-12-07 01:05:14 CST, 2017-12-07 06:29:29 CST,5.4, Sleep, Home, 
12/7/17, 2017-12-07 15:11:19, 2017-12-07 08:56:34 CST, 2017-12-07 09:11:19 CST,0.25, Transport, , 
12/7/17, 2017-12-07 15:16:18, 2017-12-07 09:11:19 CST, 2017-12-07 09:16:18 CST,0.08, Walk, , 
12/7/17, 2017-12-07 22:11:34, 2017-12-07 16:06:31 CST, 2017-12-07 16:11:34 CST,0.08, Walk, , 
12/7/17, 2017-12-07 22:19:15, 2017-12-07 16:13:24 CST, 2017-12-07 16:19:15 CST,0.1, Transport, , 
12/7/17, 2017-12-07 22:39:27, 2017-12-07 16:31:04 CST, 2017-12-07 16:39:27 CST,0.14, Transport, , 
12/7/17, 2017-12-08 12:28:22, 2017-12-07 16:39:27 CST, 2017-12-08 06:28:22 CST,13.82, Work, Home, 
12/8/17, 2017-12-08 12:00:39, 2017-12-08 01:37:04 CST, 2017-12-08 06:00:39 CST,4.39, Sleep, Home, 
12/8/17, 2017-12-08 19:07:20, 2017-12-08 06:29:07 CST, 2017-12-08 13:07:20 CST,6.64, Work, Bagel Art, 
12/8/17, 2017-12-08 19:10:14, 2017-12-08 13:07:19 CST, 2017-12-08 13:10:14 CST,0.05, Commute to home, , 
12/8/17, 2017-12-08 19:10:13, 2017-12-08 13:07:20 CST, 2017-12-08 13:10:13 CST,0.05, Walk, , 
12/8/17, 2017-12-10 00:40:36, 2017-12-08 13:10:14 CST, 2017-12-09 18:40:36 CST,29.51, Home, Home, 
12/8/17, 2017-12-08 22:00:00, 2017-12-08 13:30:00 CST, 2017-12-08 16:00:00 CST,2.5, Work, Home, 
12/9/17, 2017-12-09 13:20:13, 2017-12-08 22:34:39 CST, 2017-12-09 07:20:13 CST,8.76, Sleep, Home, 
12/10/17, 2017-12-10 01:37:05, 2017-12-09 18:41:25 CST, 2017-12-09 19:37:05 CST,0.93, Groceries, Jewel-Osco, 
12/10/17, 2017-12-10 12:52:51, 2017-12-09 19:41:40 CST, 2017-12-10 06:52:51 CST,11.19, Home, Home, 
12/10/17, 2017-12-10 11:31:02, 2017-12-09 22:09:09 CST, 2017-12-10 05:31:02 CST,7.36, Sleep, Home, 
12/10/17, 2017-12-10 17:57:17, 2017-12-10 06:53:16 CST, 2017-12-10 11:57:17 CST,5.07, Work, Bagel Art, 
12/10/17, 2017-12-10 21:54:04, 2017-12-10 11:58:41 CST, 2017-12-10 15:54:04 CST,3.92, Work, Bagel Art, 
12/10/17, 2017-12-10 22:03:50, 2017-12-10 15:54:04 CST, 2017-12-10 16:03:50 CST,0.16, Walk, , 
12/10/17, 2017-12-11 00:50:24, 2017-12-10 16:03:51 CST, 2017-12-10 18:50:24 CST,2.78, Drinks, Smylie Brothers Brewing Co., 
12/11/17, 2017-12-11 00:57:09, 2017-12-10 18:50:24 CST, 2017-12-10 18:57:09 CST,0.11, Walk, , 
12/11/17, 2017-12-11 12:25:23, 2017-12-10 18:57:10 CST, 2017-12-11 06:25:23 CST,11.47, Home, Home, 
12/11/17, 2017-12-11 11:37:11, 2017-12-10 22:00:05 CST, 2017-12-11 05:37:11 CST,7.62, Sleep, Home, 
12/11/17, 2017-12-11 21:17:32, 2017-12-11 06:26:08 CST, 2017-12-11 15:17:32 CST,8.86, Work, Bagel Art, 
12/11/17, 2017-12-11 21:19:21, 2017-12-11 15:17:31 CST, 2017-12-11 15:19:21 CST,0.03, Commute to home, , 
12/11/17, 2017-12-12 14:26:23, 2017-12-11 15:19:21 CST, 2017-12-12 08:26:23 CST,17.12, Work, Home, 
12/12/17, 2017-12-12 11:41:49, 2017-12-11 23:43:42 CST, 2017-12-12 05:41:49 CST,5.97, Sleep, Home, 
12/12/17, 2017-12-12 14:42:23, 2017-12-12 08:26:23 CST, 2017-12-12 08:42:23 CST,0.27, Transport, , 
12/12/17, 2017-12-12 14:47:35, 2017-12-12 08:42:23 CST, 2017-12-12 08:47:35 CST,0.09, Walk, , 
12/12/17, 2017-12-12 22:29:27, 2017-12-12 16:23:15 CST, 2017-12-12 16:29:27 CST,0.1, Transport, , 
12/12/17, 2017-12-12 22:45:54, 2017-12-12 16:39:48 CST, 2017-12-12 16:45:54 CST,0.1, Transport, , 
12/12/17, 2017-12-13 12:27:20, 2017-12-12 16:46:11 CST, 2017-12-13 06:27:20 CST,13.69, Work, Home, 
12/13/17, 2017-12-13 11:50:09, 2017-12-12 22:45:08 CST, 2017-12-13 05:50:09 CST,7.08, Sleep, Home, 
12/13/17, 2017-12-13 18:05:25, 2017-12-13 06:27:39 CST, 2017-12-13 12:05:25 CST,5.63, Work, Bagel Art, 
12/13/17, 2017-12-14 16:16:11, 2017-12-13 12:06:04 CST, 2017-12-14 10:16:11 CST,22.17, Home, Home, 
12/14/17, 2017-12-14 13:30:10, 2017-12-13 21:58:41 CST, 2017-12-14 07:30:10 CST,9.52, Sleep, Home, 
12/14/17, 2017-12-14 16:55:18, 2017-12-14 10:16:10 CST, 2017-12-14 10:55:18 CST,0.65, Commute to work, , 
12/14/17, 2017-12-14 16:30:07, 2017-12-14 10:16:11 CST, 2017-12-14 10:30:07 CST,0.23, Walk, , 
12/14/17, 2017-12-14 16:47:11, 2017-12-14 10:36:14 CST, 2017-12-14 10:47:11 CST,0.18, Transport, CTA - Howard, 
12/14/17, 2017-12-14 16:52:30, 2017-12-14 10:47:11 CST, 2017-12-14 10:52:30 CST,0.09, Transport, , 
12/14/17, 2017-12-14 16:55:17, 2017-12-14 10:52:30 CST, 2017-12-14 10:55:17 CST,0.05, Walk, , 
12/14/17, 2017-12-14 17:29:37, 2017-12-14 10:55:18 CST, 2017-12-14 11:29:37 CST,0.57, School, Oakton Community College, 
12/14/17, 2017-12-14 18:02:04, 2017-12-14 11:56:22 CST, 2017-12-14 12:02:04 CST,0.1, Transport, CTA - Oakton-Skokie, 
12/14/17, 2017-12-14 18:04:44, 2017-12-14 12:02:04 CST, 2017-12-14 12:04:44 CST,0.04, Transport, , 
12/14/17, 2017-12-14 22:40:46, 2017-12-14 12:50:30 CST, 2017-12-14 16:40:46 CST,3.84, Home, Home, 
12/14/17, 2017-12-14 23:09:34, 2017-12-14 16:41:05 CST, 2017-12-14 17:09:34 CST,0.47, Transport, , 
12/14/17, 2017-12-15 00:01:24, 2017-12-14 17:12:06 CST, 2017-12-14 18:01:24 CST,0.82, Shopping, Apple Lincoln Park, 
12/15/17, 2017-12-15 00:14:23, 2017-12-14 18:01:24 CST, 2017-12-14 18:14:23 CST,0.22, Transport, , 
12/15/17, 2017-12-15 00:43:36, 2017-12-14 18:14:49 CST, 2017-12-14 18:43:36 CST,0.48, Dinner, 5411 Empanadas, 
12/15/17, 2017-12-15 00:53:06, 2017-12-14 18:43:36 CST, 2017-12-14 18:53:06 CST,0.16, Walk, , 
12/15/17, 2017-12-15 01:17:40, 2017-12-14 18:58:55 CST, 2017-12-14 19:17:40 CST,0.31, Transport, , 
12/15/17, 2017-12-15 12:28:19, 2017-12-14 19:17:40 CST, 2017-12-15 06:28:19 CST,11.18, Home, Home, 
12/15/17, 2017-12-15 11:50:12, 2017-12-14 23:50:25 CST, 2017-12-15 05:50:12 CST,6, Sleep, Home, 
12/15/17, 2017-12-15 16:53:37, 2017-12-15 06:28:29 CST, 2017-12-15 10:53:37 CST,4.42, Work, Bagel Art, 
12/15/17, 2017-12-15 17:14:09, 2017-12-15 11:11:41 CST, 2017-12-15 11:14:09 CST,0.04, Transport, , 
12/15/17, 2017-12-16 01:29:52, 2017-12-15 11:14:09 CST, 2017-12-15 19:29:52 CST,8.26, Work, Home, 
12/16/17, 2017-12-16 01:35:58, 2017-12-15 19:29:52 CST, 2017-12-15 19:35:58 CST,0.1, Cycle, , 
12/16/17, 2017-12-16 04:37:50, 2017-12-15 19:35:58 CST, 2017-12-15 22:37:50 CST,3.03, Friends, Naomi’s, 
12/16/17, 2017-12-16 04:40:50, 2017-12-15 22:37:50 CST, 2017-12-15 22:40:50 CST,0.05, Transport, , 
12/16/17, 2017-12-16 11:23:28, 2017-12-15 22:40:50 CST, 2017-12-16 05:23:28 CST,6.71, Home, Home, 
12/16/17, 2017-12-16 10:55:09, 2017-12-15 22:54:50 CST, 2017-12-16 04:55:09 CST,6.01, Sleep, Home, 
12/16/17, 2017-12-16 18:34:25, 2017-12-16 05:24:13 CST, 2017-12-16 12:34:25 CST,7.17, Work, Bagel Art, 
12/16/17, 2017-12-16 22:16:45, 2017-12-16 12:35:10 CST, 2017-12-16 16:16:45 CST,3.69, Work, Bagel Art, 
12/16/17, 2017-12-16 22:52:43, 2017-12-16 16:16:44 CST, 2017-12-16 16:52:43 CST,0.6, Commute to home, , 
12/16/17, 2017-12-16 22:29:19, 2017-12-16 16:16:45 CST, 2017-12-16 16:29:19 CST,0.21, Walk, , 
12/16/17, 2017-12-16 22:52:42, 2017-12-16 16:35:22 CST, 2017-12-16 16:52:42 CST,0.29, Walk, , 
12/16/17, 2017-12-18 16:16:56, 2017-12-16 16:52:43 CST, 2017-12-18 10:16:56 CST,41.4, Home, Home, 
12/17/17, 2017-12-17 11:54:22, 2017-12-16 22:29:37 CST, 2017-12-17 05:54:22 CST,7.41, Sleep, Home, 
12/18/17, 2017-12-18 14:00:27, 2017-12-17 23:29:16 CST, 2017-12-18 08:00:27 CST,8.52, Sleep, Home, 
12/18/17, 2017-12-18 16:28:16, 2017-12-18 10:16:56 CST, 2017-12-18 10:28:16 CST,0.19, Walk, , 
12/18/17, 2017-12-18 21:37:53, 2017-12-18 10:28:17 CST, 2017-12-18 15:37:53 CST,5.16, Home, Home, 
12/18/17, 2017-12-18 22:00:28, 2017-12-18 15:37:53 CST, 2017-12-18 16:00:28 CST,0.38, Walk, , 
12/18/17, 2017-12-20 00:59:33, 2017-12-18 16:00:29 CST, 2017-12-19 18:59:33 CST,26.98, Home, Home, 
12/19/17, 2017-12-19 13:52:31, 2017-12-18 22:44:01 CST, 2017-12-19 07:52:31 CST,9.14, Sleep, Home, 
12/20/17, 2017-12-20 01:05:32, 2017-12-19 18:59:33 CST, 2017-12-19 19:05:32 CST,0.1, Walk, , 
12/20/17, 2017-12-20 04:29:18, 2017-12-19 19:05:33 CST, 2017-12-19 22:29:18 CST,3.4, Friends, Century 12 Evanston/CinéArts 6 and XD, 
12/20/17, 2017-12-20 04:38:34, 2017-12-19 22:29:18 CST, 2017-12-19 22:38:34 CST,0.15, Walk, , 
12/20/17, 2017-12-21 01:30:56, 2017-12-19 22:38:35 CST, 2017-12-20 19:30:56 CST,20.87, Work, Bagel Art, 
12/20/17, 2017-12-20 11:50:16, 2017-12-20 01:11:13 CST, 2017-12-20 05:50:16 CST,4.65, Sleep, Bagel Art, 
12/21/17, 2017-12-21 01:38:27, 2017-12-20 19:30:56 CST, 2017-12-20 19:38:27 CST,0.13, Walk, , 
12/21/17, 2017-12-21 02:09:32, 2017-12-20 19:38:28 CST, 2017-12-20 20:09:32 CST,0.52, Friends, Lakeshore, 
12/21/17, 2017-12-21 02:26:37, 2017-12-20 20:09:32 CST, 2017-12-20 20:26:37 CST,0.28, Walk, , 
12/21/17, 2017-12-22 02:14:39, 2017-12-20 20:26:38 CST, 2017-12-21 20:14:39 CST,23.8, Work, Bagel Art, 
12/21/17, 2017-12-21 11:50:07, 2017-12-20 22:24:30 CST, 2017-12-21 05:50:07 CST,7.43, Sleep, Bagel Art, 
12/22/17, 2017-12-22 02:52:43, 2017-12-21 20:44:34 CST, 2017-12-21 20:52:43 CST,0.14, Transport, , 
12/22/17, 2017-12-22 03:13:18, 2017-12-21 20:59:26 CST, 2017-12-21 21:13:18 CST,0.23, Transport, , 
12/22/17, 2017-12-22 04:54:00, 2017-12-21 21:13:18 CST, 2017-12-21 22:54:00 CST,1.68, Drinks, Green Mill Cocktail Lounge, 
12/22/17, 2017-12-22 05:11:11, 2017-12-21 22:54:00 CST, 2017-12-21 23:11:11 CST,0.29, Transport, , 
12/22/17, 2017-12-22 05:25:02, 2017-12-21 23:21:08 CST, 2017-12-21 23:25:02 CST,0.07, Transport, , 
12/22/17, 2017-12-22 05:27:08, 2017-12-21 23:25:02 CST, 2017-12-21 23:27:08 CST,0.04, Walk, , 
12/22/17, 2017-12-23 22:36:05, 2017-12-21 23:27:09 CST, 2017-12-23 16:36:05 CST,41.15, Work, Bagel Art, 
12/22/17, 2017-12-22 11:50:10, 2017-12-22 00:09:44 CST, 2017-12-22 05:50:10 CST,5.67, Sleep, Bagel Art, 
12/23/17, 2017-12-23 11:54:50, 2017-12-22 22:50:14 CST, 2017-12-23 05:54:50 CST,7.08, Sleep, Bagel Art, 
12/23/17, 2017-12-23 22:53:03, 2017-12-23 16:36:05 CST, 2017-12-23 16:53:03 CST,0.28, Walk, , 
12/23/17, 2017-12-23 23:56:28, 2017-12-23 16:53:04 CST, 2017-12-23 17:56:28 CST,1.06, Groceries, Valli Produce, 
12/23/17, 2017-12-24 00:03:21, 2017-12-23 17:57:18 CST, 2017-12-23 18:03:21 CST,0.1, Work, , 
12/24/17, 2017-12-24 00:05:29, 2017-12-23 18:03:20 CST, 2017-12-23 18:05:29 CST,0.04, Commute to home, , 
12/24/17, 2017-12-24 00:05:29, 2017-12-23 18:03:21 CST, 2017-12-23 18:05:29 CST,0.04, Transport, , 
12/24/17, 2017-12-24 12:20:14, 2017-12-23 18:05:29 CST, 2017-12-24 06:20:14 CST,12.25, Home, Home, 
12/24/17, 2017-12-24 09:00:40, 2017-12-23 23:24:03 CST, 2017-12-24 03:00:40 CST,3.61, Sleep, Home, 
12/24/17, 2017-12-24 19:23:17, 2017-12-24 06:20:14 CST, 2017-12-24 13:23:17 CST,7.05, Work, Bagel Art, 
12/24/17, 2017-12-25 23:55:25, 2017-12-24 13:23:17 CST, 2017-12-25 17:55:25 CST,28.54, Home, Home, 
12/25/17, 2017-12-25 14:48:31, 2017-12-24 23:55:05 CST, 2017-12-25 08:48:31 CST,8.89, Sleep, Home, 
12/25/17, 2017-12-26 12:18:58, 2017-12-25 17:55:25 CST, 2017-12-26 06:18:58 CST,12.39, Home, Home, 
12/26/17, 2017-12-26 11:50:27, 2017-12-25 23:07:20 CST, 2017-12-26 05:50:27 CST,6.72, Sleep, Home, 
12/26/17, 2017-12-26 21:24:56, 2017-12-26 06:19:43 CST, 2017-12-26 15:24:56 CST,9.09, Work, Bagel Art, 
12/26/17, 2017-12-26 22:54:02, 2017-12-26 15:25:11 CST, 2017-12-26 16:54:02 CST,1.48, Work, Home, 
12/26/17, 2017-12-26 23:00:00, 2017-12-26 16:54:02 CST, 2017-12-26 17:00:00 CST,0.1, Transport, , 
12/26/17, 2017-12-26 23:08:24, 2017-12-26 17:05:43 CST, 2017-12-26 17:08:24 CST,0.04, Transport, , 
12/26/17, 2017-12-27 01:53:11, 2017-12-26 17:11:21 CST, 2017-12-26 19:53:11 CST,2.7, Dinner, Rogers Park Social, 
12/27/17, 2017-12-27 02:03:30, 2017-12-26 19:53:11 CST, 2017-12-26 20:03:30 CST,0.17, Transport, , 
12/27/17, 2017-12-27 02:22:55, 2017-12-26 20:03:30 CST, 2017-12-26 20:22:55 CST,0.32, Groceries, Jewel-Osco, 
12/27/17, 2017-12-27 12:25:10, 2017-12-26 20:23:19 CST, 2017-12-27 06:25:10 CST,10.03, Home, Home, 
12/27/17, 2017-12-27 11:54:38, 2017-12-26 22:09:14 CST, 2017-12-27 05:54:38 CST,7.76, Sleep, Home, 
12/27/17, 2017-12-27 16:21:50, 2017-12-27 06:25:55 CST, 2017-12-27 10:21:50 CST,3.93, Work, Bagel Art, 
12/27/17, 2017-12-27 23:29:12, 2017-12-27 10:22:35 CST, 2017-12-27 17:29:12 CST,7.11, Work, Bagel Art, 
12/27/17, 2017-12-28 00:23:21, 2017-12-27 17:29:12 CST, 2017-12-27 18:23:21 CST,0.9, Transport, , 
12/28/17, 2017-12-28 00:33:19, 2017-12-27 18:23:21 CST, 2017-12-27 18:33:19 CST,0.17, Walk, , 
12/28/17, 2017-12-28 04:12:46, 2017-12-27 18:33:20 CST, 2017-12-27 22:12:46 CST,3.66, Dinner, Furious Spoon, 
12/28/17, 2017-12-28 04:19:41, 2017-12-27 22:12:46 CST, 2017-12-27 22:19:41 CST,0.12, Walk, , 
12/28/17, 2017-12-28 05:13:18, 2017-12-27 22:19:54 CST, 2017-12-27 23:13:18 CST,0.89, Transport, , 
12/28/17, 2017-12-28 05:32:50, 2017-12-27 23:20:46 CST, 2017-12-27 23:32:50 CST,0.2, Transport, , 
12/28/17, 2017-12-28 22:23:53, 2017-12-27 23:32:50 CST, 2017-12-28 16:23:53 CST,16.85, Work, Bagel Art, 
12/28/17, 2017-12-28 11:54:58, 2017-12-28 00:43:10 CST, 2017-12-28 05:54:58 CST,5.2, Sleep, Bagel Art, 
12/28/17, 2017-12-28 23:21:44, 2017-12-28 16:23:53 CST, 2017-12-28 17:21:44 CST,0.96, Work, Bagel Art, 
12/29/17, 2017-12-29 11:50:14, 2017-12-28 22:59:56 CST, 2017-12-29 05:50:14 CST,6.84, Sleep, , 
12/29/17, 2017-12-30 12:26:05, 2017-12-29 08:25:30 CST, 2017-12-30 06:26:05 CST,22.01, Home, Home, 
12/30/17, 2017-12-30 11:50:10, 2017-12-29 23:59:19 CST, 2017-12-30 05:50:10 CST,5.85, Sleep, Home, 
12/30/17, 2017-12-30 17:41:29, 2017-12-30 06:26:50 CST, 2017-12-30 11:41:29 CST,5.24, Work, Bagel Art, 
12/30/17, 2017-12-30 21:27:06, 2017-12-30 11:42:14 CST, 2017-12-30 15:27:06 CST,3.75, Work, Bagel Art, 
12/30/17, 2017-12-30 21:48:32, 2017-12-30 15:27:05 CST, 2017-12-30 15:48:32 CST,0.36, Commute to home, , 
12/30/17, 2017-12-30 21:48:31, 2017-12-30 15:27:06 CST, 2017-12-30 15:48:31 CST,0.36, Walk, , 
12/30/17, 2017-12-31 12:25:05, 2017-12-30 15:48:32 CST, 2017-12-31 06:25:05 CST,14.61, Home, Home, 
12/31/17, 2017-12-31 11:25:46, 2017-12-30 22:17:07 CST, 2017-12-31 05:25:46 CST,7.14, Sleep, Home, 
12/31/17, 2017-12-31 18:30:38, 2017-12-31 06:25:51 CST, 2017-12-31 12:30:38 CST,6.08, Work, Bagel Art, 
12/31/17, 2018-01-01 01:07:12, 2017-12-31 12:31:40 CST, 2017-12-31 19:07:12 CST,6.59, Work, Bagel Art, 
1/1/18, 2018-01-01 01:19:30, 2017-12-31 19:07:12 CST, 2017-12-31 19:19:30 CST,0.21, Transport, , 
1/1/18, 2018-01-01 07:41:49, 2018-01-01 01:32:06 CST, 2018-01-01 01:41:49 CST,0.16, Transport, CTA - Loyola, 
1/1/18, 2018-01-01 07:47:06, 2018-01-01 01:41:49 CST, 2018-01-01 01:47:06 CST,0.09, Transport, , 
1/1/18, 2018-01-01 08:20:31, 2018-01-01 02:16:44 CST, 2018-01-01 02:20:31 CST,0.06, Transport, , 
1/1/18, 2018-01-01 08:26:58, 2018-01-01 02:20:31 CST, 2018-01-01 02:26:58 CST,0.11, Work, Home, 
1/1/18, 2018-01-01 15:17:34, 2018-01-01 02:49:47 CST, 2018-01-01 09:17:34 CST,6.46, Sleep, Home, 
1/1/18, 2018-01-02 13:08:46, 2018-01-01 10:06:31 CST, 2018-01-02 07:08:46 CST,21.04, Home, Home, 
1/2/18, 2018-01-02 14:02:45, 2018-01-01 22:15:36 CST, 2018-01-02 08:02:45 CST,9.79, Sleep, Home, 
1/2/18, 2018-01-02 23:02:00, 2018-01-02 07:08:46 CST, 2018-01-02 17:02:00 CST,9.89, Home, Home, 
1/2/18, 2018-01-02 23:31:08, 2018-01-02 17:02:45 CST, 2018-01-02 17:31:08 CST,0.47, Groceries, Trader Joe's, 
1/2/18, 2018-01-03 11:23:36, 2018-01-02 17:31:53 CST, 2018-01-03 05:23:36 CST,11.86, Home, Home, 
1/3/18, 2018-01-03 10:55:09, 2018-01-02 22:39:29 CST, 2018-01-03 04:55:09 CST,6.26, Sleep, Home, 
1/3/18, 2018-01-03 11:30:03, 2018-01-03 05:23:35 CST, 2018-01-03 05:30:03 CST,0.11, Commute to work, , 
1/3/18, 2018-01-03 11:30:02, 2018-01-03 05:23:36 CST, 2018-01-03 05:30:02 CST,0.11, Walk, , 
1/3/18, 2018-01-03 16:18:57, 2018-01-03 05:30:03 CST, 2018-01-03 10:18:57 CST,4.82, Work, Bagel Art, 
1/3/18, 2018-01-03 16:25:05, 2018-01-03 10:19:20 CST, 2018-01-03 10:25:05 CST,0.1, Home, Home, 
1/3/18, 2018-01-03 20:39:31, 2018-01-03 14:32:02 CST, 2018-01-03 14:39:31 CST,0.12, Walk, , 
1/4/18, 2018-01-04 11:50:07, 2018-01-03 22:20:31 CST, 2018-01-04 05:50:07 CST,7.49, Sleep, , 
1/4/18, 2018-01-04 12:41:32, 2018-01-04 06:35:07 CST, 2018-01-04 06:41:32 CST,0.11, Walk, , 
1/4/18, 2018-01-04 17:44:23, 2018-01-04 11:36:06 CST, 2018-01-04 11:44:23 CST,0.14, Walk, , 
1/4/18, 2018-01-04 18:10:07, 2018-01-04 12:04:46 CST, 2018-01-04 12:10:07 CST,0.09, Walk, , 
1/4/18, 2018-01-04 18:58:24, 2018-01-04 12:50:00 CST, 2018-01-04 12:58:24 CST,0.14, Walk, , 
1/4/18, 2018-01-04 19:25:57, 2018-01-04 13:18:51 CST, 2018-01-04 13:25:57 CST,0.12, Walk, , 
1/4/18, 2018-01-04 20:41:25, 2018-01-04 14:23:39 CST, 2018-01-04 14:41:25 CST,0.3, Walk, , 
1/4/18, 2018-01-04 21:32:26, 2018-01-04 14:59:39 CST, 2018-01-04 15:32:26 CST,0.55, Walk, , 
1/5/18, 2018-01-05 05:07:10, 2018-01-04 21:37:16 CST, 2018-01-04 23:07:10 CST,1.5, Home, Home, 
1/5/18, 2018-01-05 12:25:43, 2018-01-04 23:07:10 CST, 2018-01-05 06:25:43 CST,7.31, Home, Home, 
1/5/18, 2018-01-05 12:00:04, 2018-01-04 23:07:34 CST, 2018-01-05 06:00:04 CST,6.88, Sleep, Home, 
1/5/18, 2018-01-05 22:44:30, 2018-01-05 06:26:25 CST, 2018-01-05 16:44:30 CST,10.3, Work, Bagel Art, 
1/5/18, 2018-01-05 22:46:05, 2018-01-05 16:44:29 CST, 2018-01-05 16:46:05 CST,0.03, Commute to home, , 
1/5/18, 2018-01-06 12:27:38, 2018-01-05 16:46:05 CST, 2018-01-06 06:27:38 CST,13.69, Home, Home, 
1/6/18, 2018-01-06 11:50:10, 2018-01-05 21:30:57 CST, 2018-01-06 05:50:10 CST,8.32, Sleep, Home, 
1/6/18, 2018-01-06 22:00:01, 2018-01-06 06:28:23 CST, 2018-01-06 16:00:01 CST,9.53, Work, Bagel Art, 
1/6/18, 2018-01-07 12:25:49, 2018-01-06 16:00:46 CST, 2018-01-07 06:25:49 CST,14.42, Home, Home, 
1/7/18, 2018-01-07 11:50:05, 2018-01-06 21:45:34 CST, 2018-01-07 05:50:05 CST,8.08, Sleep, Home, 
1/7/18, 2018-01-07 21:10:31, 2018-01-07 06:26:34 CST, 2018-01-07 15:10:31 CST,8.73, Work, Bagel Art, 
1/7/18, 2018-01-07 21:11:31, 2018-01-07 15:10:30 CST, 2018-01-07 15:11:31 CST,0.02, Commute to home, , 
1/7/18, 2018-01-07 21:19:14, 2018-01-07 15:11:31 CST, 2018-01-07 15:19:14 CST,0.13, Home, Home, 
1/8/18, 2018-01-08 13:57:35, 2018-01-07 23:08:12 CST, 2018-01-08 07:57:35 CST,8.82, Home, Home, 
1/8/18, 2018-01-08 13:57:16, 2018-01-07 23:08:14 CST, 2018-01-08 07:57:16 CST,8.82, Sleep, Home, 
1/8/18, 2018-01-08 20:17:50, 2018-01-08 07:57:35 CST, 2018-01-08 14:17:50 CST,6.34, Home, Home, 
1/8/18, 2018-01-08 20:35:57, 2018-01-08 14:17:50 CST, 2018-01-08 14:35:57 CST,0.3, Walk, , 
1/8/18, 2018-01-08 21:34:07, 2018-01-08 14:35:58 CST, 2018-01-08 15:34:07 CST,0.97, Groceries, Jewel-Osco, 
1/8/18, 2018-01-09 12:22:00, 2018-01-08 15:34:52 CST, 2018-01-09 06:22:00 CST,14.79, Home, Home, 
1/9/18, 2018-01-09 11:53:10, 2018-01-08 22:29:05 CST, 2018-01-09 05:53:10 CST,7.4, Sleep, Home, 
1/9/18, 2018-01-09 12:25:01, 2018-01-09 06:21:59 CST, 2018-01-09 06:25:01 CST,0.05, Commute to work, , 
1/9/18, 2018-01-09 12:25:00, 2018-01-09 06:22:48 CST, 2018-01-09 06:25:00 CST,0.04, Walk, , 
1/9/18, 2018-01-09 18:33:41, 2018-01-09 06:25:01 CST, 2018-01-09 12:33:41 CST,6.14, Work, Bagel Art, 
1/9/18, 2018-01-09 18:44:30, 2018-01-09 12:34:22 CST, 2018-01-09 12:44:30 CST,0.17, Home, Home, 
1/9/18, 2018-01-09 19:08:46, 2018-01-09 12:55:00 CST, 2018-01-09 13:08:46 CST,0.23, Walk, , 
1/9/18, 2018-01-09 21:22:52, 2018-01-09 15:10:09 CST, 2018-01-09 15:22:52 CST,0.21, Walk, , 
1/9/18, 2018-01-09 21:49:41, 2018-01-09 15:26:47 CST, 2018-01-09 15:49:41 CST,0.38, Walk, , 
1/10/18, 2018-01-10 11:41:56, 2018-01-09 21:34:26 CST, 2018-01-10 05:41:56 CST,8.13, Sleep, Home, 
1/10/18, 2018-01-10 12:35:18, 2018-01-10 06:23:31 CST, 2018-01-10 06:35:18 CST,0.2, Walk, , 
1/10/18, 2018-01-10 17:09:01, 2018-01-10 10:56:00 CST, 2018-01-10 11:09:01 CST,0.22, Walk, , 
1/10/18, 2018-01-10 17:35:57, 2018-01-10 11:30:13 CST, 2018-01-10 11:35:57 CST,0.1, Walk, , 
1/10/18, 2018-01-10 18:10:11, 2018-01-10 12:04:44 CST, 2018-01-10 12:10:11 CST,0.09, Walk, , 
1/10/18, 2018-01-10 18:28:50, 2018-01-10 12:19:27 CST, 2018-01-10 12:28:50 CST,0.16, Walk, , 
1/10/18, 2018-01-10 21:39:37, 2018-01-10 15:07:58 CST, 2018-01-10 15:39:37 CST,0.53, Walk, , 
1/11/18, 2018-01-11 08:02:23, 2018-01-10 22:57:15 CST, 2018-01-11 02:02:23 CST,3.09, Home, Home, 
1/11/18, 2018-01-11 11:44:22, 2018-01-11 00:59:49 CST, 2018-01-11 05:44:22 CST,4.74, Sleep, Home, 
1/11/18, 2018-01-11 21:41:40, 2018-01-11 06:09:03 CST, 2018-01-11 15:41:40 CST,9.54, Work, Bagel Art, 
1/11/18, 2018-01-11 21:43:39, 2018-01-11 15:41:39 CST, 2018-01-11 15:43:39 CST,0.03, Commute to home, , 
1/11/18, 2018-01-12 12:24:16, 2018-01-11 15:43:39 CST, 2018-01-12 06:24:16 CST,14.68, Home, Home, 
1/12/18, 2018-01-12 11:50:12, 2018-01-11 22:33:37 CST, 2018-01-12 05:50:12 CST,7.28, Sleep, Home, 
1/12/18, 2018-01-12 17:45:51, 2018-01-12 06:25:01 CST, 2018-01-12 11:45:51 CST,5.35, Work, Bagel Art, 
1/12/18, 2018-01-12 17:53:42, 2018-01-12 11:46:29 CST, 2018-01-12 11:53:42 CST,0.12, Home, Home, 
1/12/18, 2018-01-12 18:04:34, 2018-01-12 11:54:10 CST, 2018-01-12 12:04:34 CST,0.17, Walk, , 
1/12/18, 2018-01-12 20:10:35, 2018-01-12 14:01:58 CST, 2018-01-12 14:10:35 CST,0.14, Walk, , 
1/12/18, 2018-01-12 21:06:48, 2018-01-12 14:50:10 CST, 2018-01-12 15:06:48 CST,0.28, Walk, , 
1/12/18, 2018-01-12 21:35:20, 2018-01-12 15:28:31 CST, 2018-01-12 15:35:20 CST,0.11, Walk, , 
1/13/18, 2018-01-13 12:47:15, 2018-01-12 23:09:51 CST, 2018-01-13 06:47:15 CST,7.62, Sleep, , 
1/13/18, 2018-01-14 12:21:18, 2018-01-13 08:07:59 CST, 2018-01-14 06:21:18 CST,22.22, Home, Home, 
1/14/18, 2018-01-14 11:56:53, 2018-01-13 23:38:57 CST, 2018-01-14 05:56:53 CST,6.3, Sleep, Home, 
1/14/18, 2018-01-14 16:08:23, 2018-01-14 06:22:03 CST, 2018-01-14 10:08:23 CST,3.77, Work, Bagel Art, 
1/14/18, 2018-01-16 14:46:16, 2018-01-14 10:08:51 CST, 2018-01-16 08:46:16 CST,46.62, Work, Home, 
1/15/18, 2018-01-15 12:00:26, 2018-01-14 23:10:09 CST, 2018-01-15 06:00:26 CST,6.84, Sleep, Home, 
1/16/18, 2018-01-16 11:50:51, 2018-01-15 23:51:16 CST, 2018-01-16 05:50:51 CST,5.99, Sleep, Home, 
1/16/18, 2018-01-16 15:03:28, 2018-01-16 08:46:25 CST, 2018-01-16 09:03:28 CST,0.28, Transport, , 
1/16/18, 2018-01-16 15:08:18, 2018-01-16 09:03:28 CST, 2018-01-16 09:08:18 CST,0.08, Walk, , 
1/17/18, 2018-01-17 01:57:07, 2018-01-16 19:51:54 CST, 2018-01-16 19:57:07 CST,0.09, Walk, , 
1/17/18, 2018-01-17 02:02:18, 2018-01-16 19:57:08 CST, 2018-01-16 20:02:18 CST,0.09, Transport, CTA - Oakton-Skokie, 
1/17/18, 2018-01-17 02:09:25, 2018-01-16 20:02:18 CST, 2018-01-16 20:09:25 CST,0.12, Transport, , 
1/17/18, 2018-01-17 02:22:53, 2018-01-16 20:18:25 CST, 2018-01-16 20:22:53 CST,0.07, Transport, , 
1/17/18, 2018-01-17 16:31:07, 2018-01-16 20:22:53 CST, 2018-01-17 10:31:07 CST,14.14, Work, Bagel Art, 
1/17/18, 2018-01-17 11:41:38, 2018-01-16 23:33:24 CST, 2018-01-17 05:41:38 CST,6.14, Sleep, Bagel Art, 
1/17/18, 2018-01-17 16:34:39, 2018-01-17 10:31:07 CST, 2018-01-17 10:34:39 CST,0.06, Transport, , 
1/17/18, 2018-01-17 17:22:33, 2018-01-17 10:34:39 CST, 2018-01-17 11:22:33 CST,0.8, Friends, Century 12 Evanston/CinéArts 6 and XD, 
1/17/18, 2018-01-17 21:51:02, 2018-01-17 11:24:18 CST, 2018-01-17 15:51:02 CST,4.45, Work, Bagel Art, 
1/17/18, 2018-01-17 22:31:08, 2018-01-17 15:51:47 CST, 2018-01-17 16:31:08 CST,0.66, Home, Home, 
1/17/18, 2018-01-17 22:33:43, 2018-01-17 16:31:08 CST, 2018-01-17 16:33:43 CST,0.04, Walk, , 
1/17/18, 2018-01-17 23:01:08, 2018-01-17 16:33:44 CST, 2018-01-17 17:01:08 CST,0.46, Transport, , 
1/17/18, 2018-01-17 23:20:56, 2018-01-17 17:10:49 CST, 2018-01-17 17:20:56 CST,0.17, Walk, , 
1/17/18, 2018-01-17 23:43:16, 2018-01-17 17:24:15 CST, 2018-01-17 17:43:16 CST,0.32, Walk, , 
1/17/18, 2018-01-18 00:03:12, 2018-01-17 17:43:17 CST, 2018-01-17 18:03:12 CST,0.33, Transport, , 
1/18/18, 2018-01-18 01:16:57, 2018-01-17 19:10:38 CST, 2018-01-17 19:16:57 CST,0.11, Cycle, , 
1/18/18, 2018-01-18 15:14:14, 2018-01-17 19:16:57 CST, 2018-01-18 09:14:14 CST,13.95, Work, Home, 
1/18/18, 2018-01-18 13:15:46, 2018-01-17 22:11:38 CST, 2018-01-18 07:15:46 CST,9.07, Sleep, Home, 
1/18/18, 2018-01-18 15:30:32, 2018-01-18 09:17:06 CST, 2018-01-18 09:30:32 CST,0.22, Transport, , 
1/18/18, 2018-01-18 15:43:35, 2018-01-18 09:30:32 CST, 2018-01-18 09:43:35 CST,0.22, Walk, , 
1/19/18, 2018-01-19 00:24:00, 2018-01-18 18:12:47 CST, 2018-01-18 18:24:00 CST,0.19, Walk, , 
1/19/18, 2018-01-19 00:40:26, 2018-01-18 18:24:19 CST, 2018-01-18 18:40:26 CST,0.27, Transport, , 
1/19/18, 2018-01-19 12:29:21, 2018-01-18 18:42:18 CST, 2018-01-19 06:29:21 CST,11.78, Work, Home, 
1/19/18, 2018-01-19 11:50:09, 2018-01-18 23:07:45 CST, 2018-01-19 05:50:09 CST,6.71, Sleep, Home, 
1/19/18, 2018-01-19 18:47:46, 2018-01-19 06:29:33 CST, 2018-01-19 12:47:46 CST,6.3, Work, Bagel Art, 
1/19/18, 2018-01-20 01:15:18, 2018-01-19 12:48:08 CST, 2018-01-19 19:15:18 CST,6.45, Work, Bagel Art, 
1/20/18, 2018-01-20 01:20:56, 2018-01-19 19:15:18 CST, 2018-01-19 19:20:56 CST,0.09, Transport, , 
1/20/18, 2018-01-20 01:31:26, 2018-01-19 19:20:56 CST, 2018-01-19 19:31:26 CST,0.18, Transport, CTA - Howard, 
1/20/18, 2018-01-20 01:34:33, 2018-01-19 19:31:54 CST, 2018-01-19 19:34:33 CST,0.04, Transport, , 
1/20/18, 2018-01-20 04:18:16, 2018-01-19 19:36:40 CST, 2018-01-19 22:18:16 CST,2.69, Dinner, Rogers Park Social, 
1/20/18, 2018-01-20 04:34:00, 2018-01-19 22:18:16 CST, 2018-01-19 22:34:00 CST,0.26, Transport, , 
1/20/18, 2018-01-20 04:43:34, 2018-01-19 22:34:00 CST, 2018-01-19 22:43:34 CST,0.16, Home, Home, 
1/20/18, 2018-01-20 12:34:58, 2018-01-20 06:23:22 CST, 2018-01-20 06:34:58 CST,0.19, Walk, , 
1/20/18, 2018-01-20 13:35:33, 2018-01-20 07:26:40 CST, 2018-01-20 07:35:33 CST,0.15, Walk, , 
1/20/18, 2018-01-20 16:05:16, 2018-01-20 09:48:44 CST, 2018-01-20 10:05:16 CST,0.28, Walk, , 
1/20/18, 2018-01-20 17:33:55, 2018-01-20 11:26:17 CST, 2018-01-20 11:33:55 CST,0.13, Walk, , 
1/20/18, 2018-01-20 18:47:59, 2018-01-20 12:13:17 CST, 2018-01-20 12:47:59 CST,0.58, Walk, , 
1/20/18, 2018-01-20 19:02:10, 2018-01-20 12:55:50 CST, 2018-01-20 13:02:10 CST,0.11, Walk, , 
1/20/18, 2018-01-20 21:46:38, 2018-01-20 13:23:44 CST, 2018-01-20 15:46:38 CST,2.38, Work, Bagel Art, 
1/20/18, 2018-01-20 22:31:38, 2018-01-20 15:46:38 CST, 2018-01-20 16:31:38 CST,0.75, Home, Home, 
1/20/18, 2018-01-21 00:11:54, 2018-01-20 16:33:24 CST, 2018-01-20 18:11:54 CST,1.64, Friends, Melissa’s, 
1/21/18, 2018-01-21 00:17:58, 2018-01-20 18:11:54 CST, 2018-01-20 18:17:58 CST,0.1, Walk, , 
1/21/18, 2018-01-21 12:25:35, 2018-01-20 18:19:14 CST, 2018-01-21 06:25:35 CST,12.11, Home, Home, 
1/21/18, 2018-01-21 11:29:50, 2018-01-21 00:30:14 CST, 2018-01-21 05:29:50 CST,4.99, Sleep, Home, 
1/21/18, 2018-01-21 18:15:14, 2018-01-21 06:26:19 CST, 2018-01-21 12:15:14 CST,5.82, Work, Bagel Art, 
1/21/18, 2018-01-23 15:22:26, 2018-01-21 12:15:59 CST, 2018-01-23 09:22:26 CST,45.11, Work, Home, 
1/22/18, 2018-01-22 11:50:09, 2018-01-21 23:28:29 CST, 2018-01-22 05:50:09 CST,6.36, Sleep, Home, 
1/23/18, 2018-01-23 13:04:45, 2018-01-22 23:07:24 CST, 2018-01-23 07:04:45 CST,7.96, Sleep, Home, 
1/23/18, 2018-01-23 15:30:35, 2018-01-23 09:22:26 CST, 2018-01-23 09:30:35 CST,0.14, Transport, , 
1/23/18, 2018-01-23 15:42:58, 2018-01-23 09:36:38 CST, 2018-01-23 09:42:58 CST,0.11, Transport, , 
1/23/18, 2018-01-23 16:03:57, 2018-01-23 09:43:09 CST, 2018-01-23 10:03:57 CST,0.35, Walk, , 
1/24/18, 2018-01-24 02:18:14, 2018-01-23 20:15:30 CST, 2018-01-23 20:18:14 CST,0.05, Walk, , 
1/24/18, 2018-01-24 02:32:24, 2018-01-23 20:18:15 CST, 2018-01-23 20:32:24 CST,0.24, Transport, CTA - Oakton-Skokie, 
1/24/18, 2018-01-24 02:38:32, 2018-01-23 20:32:24 CST, 2018-01-23 20:38:32 CST,0.1, Transport, , 
1/24/18, 2018-01-24 02:53:47, 2018-01-23 20:49:04 CST, 2018-01-23 20:53:47 CST,0.08, Transport, , 
1/24/18, 2018-01-24 11:25:37, 2018-01-23 20:54:47 CST, 2018-01-24 05:25:37 CST,8.51, Work, Home, 
1/24/18, 2018-01-24 10:49:58, 2018-01-23 23:54:33 CST, 2018-01-24 04:49:58 CST,4.92, Sleep, Home, 
1/24/18, 2018-01-24 17:33:10, 2018-01-24 05:26:22 CST, 2018-01-24 11:33:10 CST,6.11, Work, Bagel Art, 
1/24/18, 2018-01-24 17:34:15, 2018-01-24 11:33:09 CST, 2018-01-24 11:34:15 CST,0.02, Commute to home, , 
1/24/18, 2018-01-24 18:43:49, 2018-01-24 11:34:15 CST, 2018-01-24 12:43:49 CST,1.16, Home, Home, 
1/24/18, 2018-01-24 18:52:22, 2018-01-24 12:43:49 CST, 2018-01-24 12:52:22 CST,0.14, Cycle, , 
1/24/18, 2018-01-24 18:55:30, 2018-01-24 12:52:22 CST, 2018-01-24 12:55:30 CST,0.05, Walk, , 
1/24/18, 2018-01-24 19:15:03, 2018-01-24 13:09:17 CST, 2018-01-24 13:15:03 CST,0.1, Walk, , 
1/24/18, 2018-01-24 19:31:14, 2018-01-24 13:28:20 CST, 2018-01-24 13:31:14 CST,0.05, Walk, , 
1/24/18, 2018-01-25 15:29:14, 2018-01-24 13:31:15 CST, 2018-01-25 09:29:14 CST,19.97, Home, Home, 
1/25/18, 2018-01-25 11:22:24, 2018-01-24 22:58:51 CST, 2018-01-25 05:22:24 CST,6.39, Sleep, Home, 
1/25/18, 2018-01-25 15:35:03, 2018-01-25 09:29:14 CST, 2018-01-25 09:35:03 CST,0.1, Transport, , 
1/25/18, 2018-01-25 15:56:54, 2018-01-25 09:50:09 CST, 2018-01-25 09:56:54 CST,0.11, Transport, , 
1/25/18, 2018-01-25 16:05:33, 2018-01-25 09:56:54 CST, 2018-01-25 10:05:33 CST,0.14, Walk, , 
1/26/18, 2018-01-26 00:44:16, 2018-01-25 18:36:04 CST, 2018-01-25 18:44:16 CST,0.14, Walk, , 
1/26/18, 2018-01-26 00:58:43, 2018-01-25 18:44:17 CST, 2018-01-25 18:58:43 CST,0.24, Transport, , 
1/26/18, 2018-01-26 01:36:21, 2018-01-25 19:00:35 CST, 2018-01-25 19:36:21 CST,0.6, Home, Home, 
1/26/18, 2018-01-26 03:33:18, 2018-01-25 19:37:48 CST, 2018-01-25 21:33:18 CST,1.93, Drinks, Smylie Brothers Brewing Co., 
1/26/18, 2018-01-26 03:35:33, 2018-01-25 21:33:18 CST, 2018-01-25 21:35:33 CST,0.04, Transport, , 
1/26/18, 2018-01-26 12:26:36, 2018-01-25 21:35:33 CST, 2018-01-26 06:26:36 CST,8.85, Work, Home, 
1/26/18, 2018-01-26 11:43:22, 2018-01-25 22:40:31 CST, 2018-01-26 05:43:22 CST,7.05, Sleep, Home, 
1/26/18, 2018-01-26 16:16:52, 2018-01-26 06:27:21 CST, 2018-01-26 10:16:52 CST,3.83, Work, Bagel Art, 
1/26/18, 2018-01-26 16:17:56, 2018-01-26 10:16:51 CST, 2018-01-26 10:17:56 CST,0.02, Commute to home, , 
1/26/18, 2018-01-26 16:23:38, 2018-01-26 10:17:56 CST, 2018-01-26 10:23:38 CST,0.1, Home, Home, 
1/26/18, 2018-01-26 17:01:08, 2018-01-26 10:55:59 CST, 2018-01-26 11:01:08 CST,0.09, Walk, , 
1/26/18, 2018-01-26 17:42:32, 2018-01-26 11:27:58 CST, 2018-01-26 11:42:32 CST,0.24, Walk, , 
1/26/18, 2018-01-26 17:56:48, 2018-01-26 11:45:21 CST, 2018-01-26 11:56:48 CST,0.19, Walk, , 
1/26/18, 2018-01-26 21:37:19, 2018-01-26 14:51:21 CST, 2018-01-26 15:37:19 CST,0.77, Walk, , 
1/27/18, 2018-01-27 11:50:25, 2018-01-26 23:01:20 CST, 2018-01-27 05:50:25 CST,6.82, Sleep, Home, 
1/27/18, 2018-01-30 15:19:36, 2018-01-27 05:03:20 CST, 2018-01-30 09:19:36 CST,76.27, Work, Home, 
1/28/18, 2018-01-28 11:33:17, 2018-01-28 00:19:24 CST, 2018-01-28 05:33:17 CST,5.23, Sleep, Home, 
1/29/18, 2018-01-29 11:21:26, 2018-01-28 22:33:08 CST, 2018-01-29 05:21:26 CST,6.81, Sleep, Home, 
1/30/18, 2018-01-30 12:00:26, 2018-01-30 00:10:05 CST, 2018-01-30 06:00:26 CST,5.84, Sleep, Home, 
1/30/18, 2018-01-30 15:32:31, 2018-01-30 09:19:36 CST, 2018-01-30 09:32:31 CST,0.22, Transport, , 
1/30/18, 2018-01-30 15:39:08, 2018-01-30 09:33:48 CST, 2018-01-30 09:39:08 CST,0.09, Walk, , 
1/31/18, 2018-01-31 01:57:42, 2018-01-30 19:51:41 CST, 2018-01-30 19:57:42 CST,0.1, Walk, , 
1/31/18, 2018-01-31 02:03:18, 2018-01-30 19:57:43 CST, 2018-01-30 20:03:18 CST,0.09, Transport, CTA - Oakton-Skokie, 
1/31/18, 2018-01-31 02:09:23, 2018-01-30 20:03:54 CST, 2018-01-30 20:09:23 CST,0.09, Transport, , 
1/31/18, 2018-01-31 02:19:08, 2018-01-30 20:16:02 CST, 2018-01-30 20:19:08 CST,0.05, Transport, , 
1/31/18, 2018-01-31 11:26:15, 2018-01-30 20:20:28 CST, 2018-01-31 05:26:15 CST,9.1, Work, Home, 
1/31/18, 2018-01-31 10:55:34, 2018-01-30 23:32:26 CST, 2018-01-31 04:55:34 CST,5.39, Sleep, Home, 
1/31/18, 2018-01-31 11:36:28, 2018-01-31 05:26:14 CST, 2018-01-31 05:36:28 CST,0.17, Commute to work, , 
1/31/18, 2018-01-31 11:30:23, 2018-01-31 05:26:15 CST, 2018-01-31 05:30:23 CST,0.07, Walk, , 
1/31/18, 2018-01-31 11:36:27, 2018-01-31 05:33:34 CST, 2018-01-31 05:36:27 CST,0.05, Walk, , 
1/31/18, 2018-01-31 19:03:52, 2018-01-31 05:36:28 CST, 2018-01-31 13:03:52 CST,7.46, Work, Bagel Art, 
1/31/18, 2018-01-31 19:04:53, 2018-01-31 13:03:51 CST, 2018-01-31 13:04:53 CST,0.02, Commute to home, , 
1/31/18, 2018-02-01 15:37:06, 2018-01-31 13:04:53 CST, 2018-02-01 09:37:06 CST,20.54, Work, Home, 
2/1/18, 2018-02-01 12:30:25, 2018-02-01 00:24:02 CST, 2018-02-01 06:30:25 CST,6.11, Sleep, Home, 
2/1/18, 2018-02-01 15:46:47, 2018-02-01 09:42:40 CST, 2018-02-01 09:46:47 CST,0.07, Transport, , 
2/1/18, 2018-02-01 16:07:13, 2018-02-01 10:00:16 CST, 2018-02-01 10:07:13 CST,0.12, Transport, , 
2/1/18, 2018-02-01 16:20:59, 2018-02-01 10:07:13 CST, 2018-02-01 10:20:59 CST,0.23, Walk, , 
2/2/18, 2018-02-02 00:48:05, 2018-02-01 18:43:12 CST, 2018-02-01 18:48:05 CST,0.08, Walk, , 
2/2/18, 2018-02-02 20:14:14, 2018-02-01 18:48:06 CST, 2018-02-02 14:14:14 CST,19.44, Work, Bagel Art, 
2/2/18, 2018-02-02 11:15:59, 2018-02-01 21:20:51 CST, 2018-02-02 05:15:59 CST,7.92, Sleep, Bagel Art, 
2/2/18, 2018-02-04 03:49:42, 2018-02-02 14:14:55 CST, 2018-02-03 21:49:42 CST,31.58, Home, Home, 
2/3/18, 2018-02-03 10:55:27, 2018-02-02 22:45:22 CST, 2018-02-03 04:55:27 CST,6.17, Sleep, Home, 
2/4/18, 2018-02-04 12:27:53, 2018-02-03 21:49:42 CST, 2018-02-04 06:27:53 CST,8.64, Home, Home, 
2/4/18, 2018-02-04 11:50:28, 2018-02-03 23:17:01 CST, 2018-02-04 05:50:28 CST,6.56, Sleep, Home, 
2/4/18, 2018-02-04 20:56:02, 2018-02-04 06:28:29 CST, 2018-02-04 14:56:02 CST,8.46, Work, Bagel Art, 
2/4/18, 2018-02-04 21:05:41, 2018-02-04 14:56:47 CST, 2018-02-04 15:05:41 CST,0.15, Home, Home, 
2/5/18, 2018-02-05 16:10:48, 2018-02-04 21:57:45 CST, 2018-02-05 10:10:48 CST,12.22, Home, Home, 
2/5/18, 2018-02-05 10:55:37, 2018-02-04 22:46:16 CST, 2018-02-05 04:55:37 CST,6.16, Sleep, Home, 
2/5/18, 2018-02-06 17:34:23, 2018-02-05 10:10:48 CST, 2018-02-06 11:34:23 CST,25.39, Home, Home, 
2/6/18, 2018-02-06 11:46:31, 2018-02-05 22:39:58 CST, 2018-02-06 05:46:31 CST,7.11, Sleep, Home, 
2/6/18, 2018-02-06 17:46:03, 2018-02-06 11:34:23 CST, 2018-02-06 11:46:03 CST,0.19, Transport, , 
2/7/18, 2018-02-07 02:22:29, 2018-02-06 20:04:30 CST, 2018-02-06 20:22:29 CST,0.3, Transport, , 
2/7/18, 2018-02-07 11:26:25, 2018-02-06 20:22:29 CST, 2018-02-07 05:26:25 CST,9.07, Work, Home, 
2/7/18, 2018-02-07 10:55:29, 2018-02-06 22:36:59 CST, 2018-02-07 04:55:29 CST,6.31, Sleep, Home, 
2/7/18, 2018-02-07 19:16:23, 2018-02-07 05:27:06 CST, 2018-02-07 13:16:23 CST,7.82, Work, Bagel Art, 
2/7/18, 2018-02-08 15:38:43, 2018-02-07 13:16:54 CST, 2018-02-08 09:38:43 CST,20.36, Home, Home, 
2/8/18, 2018-02-08 13:00:25, 2018-02-07 21:17:54 CST, 2018-02-08 07:00:25 CST,9.71, Sleep, Home, 
2/8/18, 2018-02-08 15:43:27, 2018-02-08 09:38:43 CST, 2018-02-08 09:43:27 CST,0.08, Walk, , 
2/8/18, 2018-02-08 15:50:30, 2018-02-08 09:43:28 CST, 2018-02-08 09:50:30 CST,0.12, Transport, , 
2/8/18, 2018-02-08 16:06:00, 2018-02-08 09:59:55 CST, 2018-02-08 10:06:00 CST,0.1, Transport, , 
2/8/18, 2018-02-08 16:11:10, 2018-02-08 10:06:00 CST, 2018-02-08 10:11:10 CST,0.09, Walk, , 
2/8/18, 2018-02-09 00:12:21, 2018-02-08 17:46:05 CST, 2018-02-08 18:12:21 CST,0.44, Transport, , 
2/9/18, 2018-02-09 00:52:41, 2018-02-08 18:15:34 CST, 2018-02-08 18:52:41 CST,0.62, Home, Home, 
2/9/18, 2018-02-09 01:21:37, 2018-02-08 18:52:40 CST, 2018-02-08 19:21:37 CST,0.48, Commute to work, , 
2/9/18, 2018-02-09 01:20:52, 2018-02-08 18:53:26 CST, 2018-02-08 19:20:52 CST,0.46, Groceries, Trader Joe's, 
2/9/18, 2018-02-10 00:41:10, 2018-02-08 19:21:37 CST, 2018-02-09 18:41:10 CST,23.33, Work, Bagel Art, 
2/9/18, 2018-02-09 10:55:24, 2018-02-08 21:20:05 CST, 2018-02-09 04:55:24 CST,7.59, Sleep, Bagel Art, 
2/10/18, 2018-02-10 00:53:31, 2018-02-09 18:41:10 CST, 2018-02-09 18:53:31 CST,0.21, Transport, , 
2/10/18, 2018-02-10 06:12:49, 2018-02-10 00:02:50 CST, 2018-02-10 00:12:49 CST,0.17, Transport, , 
2/10/18, 2018-02-11 00:49:31, 2018-02-10 00:12:49 CST, 2018-02-10 18:49:31 CST,18.61, Work, Bagel Art, 
2/10/18, 2018-02-10 10:55:23, 2018-02-10 00:27:51 CST, 2018-02-10 04:55:23 CST,4.46, Sleep, Bagel Art, 
2/11/18, 2018-02-11 00:52:27, 2018-02-10 18:49:31 CST, 2018-02-10 18:52:27 CST,0.05, Transport, , 
2/11/18, 2018-02-11 05:07:03, 2018-02-10 18:52:27 CST, 2018-02-10 23:07:03 CST,4.24, Friends, Melissa’s, 
2/11/18, 2018-02-11 05:13:29, 2018-02-10 23:07:03 CST, 2018-02-10 23:13:29 CST,0.11, Transport, , 
2/11/18, 2018-02-13 15:31:34, 2018-02-10 23:13:29 CST, 2018-02-13 09:31:34 CST,58.3, Work, Home, 
2/11/18, 2018-02-11 11:50:27, 2018-02-10 23:54:06 CST, 2018-02-11 05:50:27 CST,5.94, Sleep, Home, 
2/12/18, 2018-02-12 10:55:26, 2018-02-11 22:49:57 CST, 2018-02-12 04:55:26 CST,6.09, Sleep, Home, 
2/13/18, 2018-02-13 12:15:08, 2018-02-13 00:38:49 CST, 2018-02-13 06:15:08 CST,5.61, Sleep, Home, 
2/13/18, 2018-02-13 15:37:03, 2018-02-13 09:32:22 CST, 2018-02-13 09:37:03 CST,0.08, Transport, , 
2/13/18, 2018-02-13 15:50:10, 2018-02-13 09:45:36 CST, 2018-02-13 09:50:10 CST,0.08, Transport, , 
2/14/18, 2018-02-14 02:17:29, 2018-02-13 20:10:43 CST, 2018-02-13 20:17:29 CST,0.11, Walk, , 
2/14/18, 2018-02-14 02:32:54, 2018-02-13 20:17:30 CST, 2018-02-13 20:32:54 CST,0.26, Transport, , 
2/14/18, 2018-02-14 21:22:58, 2018-02-13 20:32:55 CST, 2018-02-14 15:22:58 CST,18.83, Work, Bagel Art, 
2/14/18, 2018-02-14 12:38:37, 2018-02-13 20:38:09 CST, 2018-02-14 06:38:37 CST,10.01, Sleep, Bagel Art, 
2/14/18, 2018-02-14 21:24:21, 2018-02-14 15:22:57 CST, 2018-02-14 15:24:21 CST,0.02, Commute to home, , 
2/14/18, 2018-02-14 22:00:14, 2018-02-14 15:24:21 CST, 2018-02-14 16:00:14 CST,0.6, Home, Home, 
2/14/18, 2018-02-14 22:37:36, 2018-02-14 16:00:14 CST, 2018-02-14 16:37:36 CST,0.62, Walk, , 
2/14/18, 2018-02-15 15:01:21, 2018-02-14 16:37:37 CST, 2018-02-15 09:01:21 CST,16.4, Home, Home, 
2/15/18, 2018-02-15 12:30:24, 2018-02-14 23:53:17 CST, 2018-02-15 06:30:24 CST,6.62, Sleep, Home, 
2/15/18, 2018-02-15 15:42:12, 2018-02-15 09:01:20 CST, 2018-02-15 09:42:12 CST,0.68, Commute to work, , 
2/15/18, 2018-02-15 15:06:40, 2018-02-15 09:01:21 CST, 2018-02-15 09:06:40 CST,0.09, Walk, , 
2/15/18, 2018-02-15 15:21:07, 2018-02-15 09:07:36 CST, 2018-02-15 09:21:07 CST,0.23, Transport, , 
2/15/18, 2018-02-15 15:27:30, 2018-02-15 09:21:07 CST, 2018-02-15 09:27:30 CST,0.11, Walk, , 
2/15/18, 2018-02-15 17:28:05, 2018-02-15 09:42:12 CST, 2018-02-15 11:28:05 CST,1.76, School, Oakton Community College, 
2/16/18, 2018-02-16 00:23:26, 2018-02-15 18:16:36 CST, 2018-02-15 18:23:26 CST,0.11, Walk, , 
2/16/18, 2018-02-16 01:08:02, 2018-02-15 19:02:48 CST, 2018-02-15 19:08:02 CST,0.09, Transport, , 
2/16/18, 2018-02-16 01:22:14, 2018-02-15 19:18:15 CST, 2018-02-15 19:22:14 CST,0.07, Transport, , 
2/16/18, 2018-02-16 11:25:39, 2018-02-15 19:24:20 CST, 2018-02-16 05:25:39 CST,10.02, Home, Home, 
2/16/18, 2018-02-16 10:55:26, 2018-02-15 22:09:46 CST, 2018-02-16 04:55:26 CST,6.76, Sleep, Home, 
2/16/18, 2018-02-16 20:41:14, 2018-02-16 05:26:25 CST, 2018-02-16 14:41:14 CST,9.25, Work, Bagel Art, 
2/16/18, 2018-02-16 20:42:18, 2018-02-16 14:41:13 CST, 2018-02-16 14:42:18 CST,0.02, Commute to home, , 
2/16/18, 2018-02-17 11:26:00, 2018-02-16 14:42:18 CST, 2018-02-17 05:26:00 CST,14.73, Home, Home, 
2/17/18, 2018-02-17 10:55:28, 2018-02-16 21:35:25 CST, 2018-02-17 04:55:28 CST,7.33, Sleep, Home, 
2/17/18, 2018-02-17 11:27:06, 2018-02-17 05:25:59 CST, 2018-02-17 05:27:06 CST,0.02, Commute to work, , 
2/17/18, 2018-02-17 21:41:05, 2018-02-17 05:27:06 CST, 2018-02-17 15:41:05 CST,10.23, Work, Bagel Art, 
2/17/18, 2018-02-18 12:25:58, 2018-02-17 15:41:42 CST, 2018-02-18 06:25:58 CST,14.74, Home, Home, 
2/18/18, 2018-02-18 11:50:33, 2018-02-17 21:11:07 CST, 2018-02-18 05:50:33 CST,8.66, Sleep, Home, 
2/18/18, 2018-02-18 20:51:58, 2018-02-18 06:26:43 CST, 2018-02-18 14:51:58 CST,8.42, Work, Bagel Art, 
2/18/18, 2018-02-19 11:26:56, 2018-02-18 14:52:43 CST, 2018-02-19 05:26:56 CST,14.57, Home, Home, 
2/19/18, 2018-02-19 11:00:21, 2018-02-18 23:36:44 CST, 2018-02-19 05:00:21 CST,5.39, Sleep, Home, 
2/19/18, 2018-02-19 19:14:04, 2018-02-19 05:27:48 CST, 2018-02-19 13:14:04 CST,7.77, Work, Bagel Art, 
2/19/18, 2018-02-19 19:15:04, 2018-02-19 13:14:03 CST, 2018-02-19 13:15:04 CST,0.02, Commute to home, , 
2/19/18, 2018-02-20 01:21:23, 2018-02-19 13:15:04 CST, 2018-02-19 19:21:23 CST,6.11, Home, Home, 
2/20/18, 2018-02-20 01:27:22, 2018-02-19 19:21:23 CST, 2018-02-19 19:27:22 CST,0.1, Walk, , 
2/20/18, 2018-02-20 02:02:08, 2018-02-19 19:27:23 CST, 2018-02-19 20:02:08 CST,0.58, Friends, Century 12 Evanston/CinéArts 6 and XD, 
2/20/18, 2018-02-20 02:38:31, 2018-02-19 20:32:58 CST, 2018-02-19 20:38:31 CST,0.09, Walk, , 
2/20/18, 2018-02-20 15:16:16, 2018-02-19 20:38:32 CST, 2018-02-20 09:16:16 CST,12.63, Home, Home, 
2/20/18, 2018-02-20 12:25:27, 2018-02-19 23:23:34 CST, 2018-02-20 06:25:27 CST,7.03, Sleep, Home, 
2/20/18, 2018-02-20 15:46:32, 2018-02-20 09:16:15 CST, 2018-02-20 09:46:32 CST,0.5, Commute to work, , 
2/20/18, 2018-02-20 15:32:32, 2018-02-20 09:16:16 CST, 2018-02-20 09:32:32 CST,0.27, Transport, , 
2/20/18, 2018-02-20 15:41:46, 2018-02-20 09:32:32 CST, 2018-02-20 09:41:46 CST,0.15, Walk, , 
2/20/18, 2018-02-20 17:36:14, 2018-02-20 09:46:32 CST, 2018-02-20 11:36:14 CST,1.83, School, , 
2/20/18, 2018-02-20 19:54:52, 2018-02-20 11:45:24 CST, 2018-02-20 13:54:52 CST,2.16, School, , 
2/20/18, 2018-02-20 19:59:18, 2018-02-20 13:54:52 CST, 2018-02-20 13:59:18 CST,0.07, Walk, , 
2/20/18, 2018-02-21 02:41:58, 2018-02-20 14:00:03 CST, 2018-02-20 20:41:58 CST,6.7, School, , 
2/21/18, 2018-02-21 02:56:55, 2018-02-20 20:41:58 CST, 2018-02-20 20:56:55 CST,0.25, Transport, , 
2/21/18, 2018-02-21 20:29:59, 2018-02-20 20:56:55 CST, 2018-02-21 14:29:59 CST,17.55, Work, Bagel Art, 
2/21/18, 2018-02-21 11:00:26, 2018-02-20 22:34:21 CST, 2018-02-21 05:00:26 CST,6.43, Sleep, Bagel Art, 
2/21/18, 2018-02-21 20:32:07, 2018-02-21 14:29:59 CST, 2018-02-21 14:32:07 CST,0.04, Walk, , 
2/21/18, 2018-02-21 21:10:27, 2018-02-21 14:32:08 CST, 2018-02-21 15:10:27 CST,0.64, Groceries, Jewel-Osco, 
2/21/18, 2018-02-22 00:52:02, 2018-02-21 15:23:48 CST, 2018-02-21 18:52:02 CST,3.47, Home, Home, 
2/22/18, 2018-02-22 00:58:06, 2018-02-21 18:52:02 CST, 2018-02-21 18:58:06 CST,0.1, Walk, , 
2/22/18, 2018-02-22 01:19:26, 2018-02-21 19:03:16 CST, 2018-02-21 19:19:26 CST,0.27, Transport, , 
2/22/18, 2018-02-22 01:26:04, 2018-02-21 19:19:26 CST, 2018-02-21 19:26:04 CST,0.11, Walk, , 
2/22/18, 2018-02-22 06:31:32, 2018-02-21 19:26:05 CST, 2018-02-22 00:31:32 CST,5.09, Friends, Ludvig’s, 
2/22/18, 2018-02-22 06:52:30, 2018-02-22 00:31:32 CST, 2018-02-22 00:52:30 CST,0.35, Transport, , 
2/22/18, 2018-02-22 15:32:13, 2018-02-22 00:52:30 CST, 2018-02-22 09:32:13 CST,8.66, Home, Home, 
2/22/18, 2018-02-22 12:23:11, 2018-02-22 01:15:39 CST, 2018-02-22 06:23:11 CST,5.13, Sleep, Home, 
2/22/18, 2018-02-22 15:37:55, 2018-02-22 09:32:13 CST, 2018-02-22 09:37:55 CST,0.1, Transport, , 
2/22/18, 2018-02-22 15:54:50, 2018-02-22 09:47:29 CST, 2018-02-22 09:54:50 CST,0.12, Transport, , 
2/22/18, 2018-02-22 15:59:46, 2018-02-22 09:55:11 CST, 2018-02-22 09:59:46 CST,0.08, Walk, , 
2/22/18, 2018-02-22 22:43:21, 2018-02-22 16:18:40 CST, 2018-02-22 16:43:21 CST,0.41, School, Oakton Community College, 
2/22/18, 2018-02-22 22:45:59, 2018-02-22 16:43:21 CST, 2018-02-22 16:45:59 CST,0.04, Walk, , 
2/23/18, 2018-02-23 00:13:14, 2018-02-22 18:06:04 CST, 2018-02-22 18:13:14 CST,0.12, Walk, , 
2/23/18, 2018-02-23 00:30:05, 2018-02-22 18:14:20 CST, 2018-02-22 18:30:05 CST,0.26, Transport, , 
2/23/18, 2018-02-23 01:10:48, 2018-02-22 18:30:05 CST, 2018-02-22 19:10:48 CST,0.68, Home, Home, 
2/23/18, 2018-02-23 01:17:32, 2018-02-22 19:10:48 CST, 2018-02-22 19:17:32 CST,0.11, Walk, , 
2/23/18, 2018-02-23 04:03:09, 2018-02-22 19:17:33 CST, 2018-02-22 22:03:09 CST,2.76, Friends, Century 12 Evanston/CinéArts 6 and XD, 
2/23/18, 2018-02-23 04:05:23, 2018-02-22 22:03:09 CST, 2018-02-22 22:05:23 CST,0.04, Walk, , 
2/23/18, 2018-02-23 12:23:33, 2018-02-22 22:05:24 CST, 2018-02-23 06:23:33 CST,8.3, Work, Home, 
2/23/18, 2018-02-23 11:50:25, 2018-02-22 23:28:57 CST, 2018-02-23 05:50:25 CST,6.36, Sleep, Home, 
2/23/18, 2018-02-23 21:36:46, 2018-02-23 06:24:18 CST, 2018-02-23 15:36:46 CST,9.21, Work, Bagel Art, 
2/23/18, 2018-02-24 11:58:16, 2018-02-23 15:37:35 CST, 2018-02-24 05:58:16 CST,14.34, Home, Home, 
2/24/18, 2018-02-24 11:25:33, 2018-02-23 23:39:40 CST, 2018-02-24 05:25:33 CST,5.76, Sleep, Home, 
2/24/18, 2018-02-24 22:50:56, 2018-02-24 05:58:42 CST, 2018-02-24 16:50:56 CST,10.87, Work, Bagel Art, 
2/24/18, 2018-02-25 12:23:33, 2018-02-24 16:51:43 CST, 2018-02-25 06:23:33 CST,13.53, Home, Home, 
2/25/18, 2018-02-25 11:50:25, 2018-02-25 00:34:12 CST, 2018-02-25 05:50:25 CST,5.27, Sleep, Home, 
2/25/18, 2018-02-25 22:06:01, 2018-02-25 06:24:20 CST, 2018-02-25 16:06:01 CST,9.69, Work, Bagel Art, 
2/25/18, 2018-02-26 11:23:33, 2018-02-25 16:06:45 CST, 2018-02-26 05:23:33 CST,13.28, Home, Home, 
2/26/18, 2018-02-26 19:29:21, 2018-02-26 05:24:20 CST, 2018-02-26 13:29:21 CST,8.08, Work, Bagel Art, 
2/26/18, 2018-02-26 16:37:29, 2018-02-26 05:25:58 CST, 2018-02-26 10:37:29 CST,5.19, Sleep, Bagel Art, 
2/26/18, 2018-02-27 08:09:53, 2018-02-26 13:30:19 CST, 2018-02-27 02:09:53 CST,12.66, Home, Home, 
2/27/18, 2018-02-27 12:15:11, 2018-02-27 00:11:11 CST, 2018-02-27 06:15:11 CST,6.07, Sleep, Home, 
2/27/18, 2018-02-27 15:11:18, 2018-02-27 05:30:05 CST, 2018-02-27 09:11:18 CST,3.69, Home, Home, 
2/27/18, 2018-02-27 15:17:36, 2018-02-27 09:11:18 CST, 2018-02-27 09:17:36 CST,0.11, Transport, , 
2/27/18, 2018-02-27 15:33:02, 2018-02-27 09:28:12 CST, 2018-02-27 09:33:02 CST,0.08, Transport, , 
2/27/18, 2018-02-27 15:36:54, 2018-02-27 09:33:02 CST, 2018-02-27 09:36:54 CST,0.06, Walk, , 
2/27/18, 2018-02-27 16:56:54, 2018-02-27 10:25:38 CST, 2018-02-27 10:56:54 CST,0.52, Transport, , 
2/27/18, 2018-02-28 02:25:19, 2018-02-27 11:17:23 CST, 2018-02-27 20:25:19 CST,9.13, School, , 
2/28/18, 2018-02-28 02:55:10, 2018-02-27 20:25:18 CST, 2018-02-27 20:55:10 CST,0.5, Commute to home, , 
2/28/18, 2018-02-28 02:32:07, 2018-02-27 20:25:19 CST, 2018-02-27 20:32:07 CST,0.11, Walk, , 
2/28/18, 2018-02-28 02:38:03, 2018-02-27 20:33:05 CST, 2018-02-27 20:38:03 CST,0.08, Transport, , 
2/28/18, 2018-02-28 02:52:54, 2018-02-27 20:47:57 CST, 2018-02-27 20:52:54 CST,0.08, Transport, , 
2/28/18, 2018-03-01 15:08:31, 2018-02-27 20:55:10 CST, 2018-03-01 09:08:31 CST,36.22, Home, Home, 
2/28/18, 2018-02-28 11:00:24, 2018-02-28 00:08:14 CST, 2018-02-28 05:00:24 CST,4.87, Sleep, Home, 
3/1/18, 2018-03-01 12:48:44, 2018-02-28 20:27:44 CST, 2018-03-01 06:48:44 CST,10.35, Sleep, Home, 
3/1/18, 2018-03-01 15:48:48, 2018-03-01 09:08:30 CST, 2018-03-01 09:48:48 CST,0.67, Commute to work, , 
3/1/18, 2018-03-01 15:23:08, 2018-03-01 09:08:31 CST, 2018-03-01 09:23:08 CST,0.24, Transport, , 
3/1/18, 2018-03-01 15:26:58, 2018-03-01 09:23:08 CST, 2018-03-01 09:26:58 CST,0.06, Walk, , 
3/1/18, 2018-03-01 15:46:29, 2018-03-01 09:32:55 CST, 2018-03-01 09:46:29 CST,0.23, Walk, , 
3/1/18, 2018-03-01 18:19:34, 2018-03-01 09:48:48 CST, 2018-03-01 12:19:34 CST,2.51, School, Oakton Community College, 
3/2/18, 2018-03-02 00:20:55, 2018-03-01 18:04:59 CST, 2018-03-01 18:20:55 CST,0.27, Transport, , 
3/2/18, 2018-03-02 01:25:24, 2018-03-01 18:20:55 CST, 2018-03-01 19:25:24 CST,1.07, Home, Home, 
3/2/18, 2018-03-02 01:50:51, 2018-03-01 19:25:23 CST, 2018-03-01 19:50:51 CST,0.42, Commute to work, , 
3/2/18, 2018-03-02 11:43:02, 2018-03-01 19:50:51 CST, 2018-03-02 05:43:02 CST,9.87, Work, Home, 
3/2/18, 2018-03-02 11:16:53, 2018-03-01 21:56:52 CST, 2018-03-02 05:16:53 CST,7.33, Sleep, Home, 
3/2/18, 2018-03-02 11:44:33, 2018-03-02 05:43:01 CST, 2018-03-02 05:44:33 CST,0.03, Commute to work, , 
3/2/18, 2018-03-02 21:34:46, 2018-03-02 05:44:33 CST, 2018-03-02 15:34:46 CST,9.84, Work, Bagel Art, 
3/2/18, 2018-03-03 02:24:38, 2018-03-02 15:35:22 CST, 2018-03-02 20:24:38 CST,4.82, Home, Home, 
3/3/18, 2018-03-03 02:40:14, 2018-03-02 20:24:38 CST, 2018-03-02 20:40:14 CST,0.26, Transport, , 
3/3/18, 2018-03-03 05:48:39, 2018-03-02 23:39:02 CST, 2018-03-02 23:48:39 CST,0.16, Transport, , 
3/3/18, 2018-03-03 12:26:17, 2018-03-02 23:48:39 CST, 2018-03-03 06:26:17 CST,6.63, Home, Home, 
3/3/18, 2018-03-03 11:34:27, 2018-03-03 00:31:07 CST, 2018-03-03 05:34:27 CST,5.06, Sleep, Home, 
3/3/18, 2018-03-03 22:04:46, 2018-03-03 06:27:02 CST, 2018-03-03 16:04:46 CST,9.63, Work, Bagel Art, 
3/3/18, 2018-03-04 02:24:33, 2018-03-03 16:05:31 CST, 2018-03-03 20:24:33 CST,4.32, Home, Home, 
3/4/18, 2018-03-04 02:47:05, 2018-03-03 20:25:18 CST, 2018-03-03 20:47:05 CST,0.36, Groceries, Jewel-Osco, 
3/4/18, 2018-03-04 02:52:31, 2018-03-03 20:47:05 CST, 2018-03-03 20:52:31 CST,0.09, Transport, , 
3/4/18, 2018-03-04 06:31:48, 2018-03-03 20:52:31 CST, 2018-03-04 00:31:48 CST,3.65, Friends, Naomi’s, 
3/4/18, 2018-03-04 06:38:32, 2018-03-04 00:31:48 CST, 2018-03-04 00:38:32 CST,0.11, Walk, , 
3/4/18, 2018-03-05 20:42:50, 2018-03-04 00:38:33 CST, 2018-03-05 14:42:50 CST,38.07, Home, , 
3/4/18, 2018-03-04 11:34:56, 2018-03-04 01:02:41 CST, 2018-03-04 05:34:56 CST,4.54, Sleep, , 
3/5/18, 2018-03-05 10:55:25, 2018-03-05 00:23:24 CST, 2018-03-05 04:55:25 CST,4.53, Sleep, , 
3/5/18, 2018-03-05 22:57:28, 2018-03-05 14:42:50 CST, 2018-03-05 16:57:28 CST,2.24, Home, Home, 
3/5/18, 2018-03-05 23:00:27, 2018-03-05 16:57:28 CST, 2018-03-05 17:00:27 CST,0.05, Walk, , 
3/5/18, 2018-03-05 23:35:48, 2018-03-05 17:00:28 CST, 2018-03-05 17:35:48 CST,0.59, Shopping, CVS/pharmacy, 
3/5/18, 2018-03-05 23:39:39, 2018-03-05 17:35:48 CST, 2018-03-05 17:39:39 CST,0.06, Walk, , 
3/6/18, 2018-03-06 00:21:39, 2018-03-05 18:05:23 CST, 2018-03-05 18:21:39 CST,0.27, Walk, , 
3/6/18, 2018-03-06 15:02:50, 2018-03-05 18:21:40 CST, 2018-03-06 09:02:50 CST,14.69, Work, Home, 
3/6/18, 2018-03-06 13:17:17, 2018-03-05 23:44:59 CST, 2018-03-06 07:17:17 CST,7.54, Sleep, Home, 
3/6/18, 2018-03-06 15:07:18, 2018-03-06 09:02:50 CST, 2018-03-06 09:07:18 CST,0.07, Walk, , 
3/6/18, 2018-03-06 15:20:28, 2018-03-06 09:07:19 CST, 2018-03-06 09:20:28 CST,0.22, Transport, , 
3/6/18, 2018-03-06 15:24:10, 2018-03-06 09:20:28 CST, 2018-03-06 09:24:10 CST,0.06, Walk, , 
3/6/18, 2018-03-06 18:22:16, 2018-03-06 09:42:19 CST, 2018-03-06 12:22:16 CST,2.67, School, Oakton Community College, 
3/6/18, 2018-03-06 20:57:30, 2018-03-06 12:32:46 CST, 2018-03-06 14:57:30 CST,2.41, School, , 
3/6/18, 2018-03-06 22:43:32, 2018-03-06 15:23:18 CST, 2018-03-06 16:43:32 CST,1.34, School, , 
3/7/18, 2018-03-07 02:56:58, 2018-03-06 20:41:09 CST, 2018-03-06 20:56:58 CST,0.26, Transport, , 
3/7/18, 2018-03-07 11:24:13, 2018-03-06 20:56:58 CST, 2018-03-07 05:24:13 CST,8.45, Work, Home, 
3/7/18, 2018-03-07 10:55:23, 2018-03-07 00:21:25 CST, 2018-03-07 04:55:23 CST,4.57, Sleep, Home, 
3/7/18, 2018-03-07 19:09:22, 2018-03-07 05:24:58 CST, 2018-03-07 13:09:22 CST,7.74, Work, Bagel Art, 
3/7/18, 2018-03-08 01:34:47, 2018-03-07 13:09:34 CST, 2018-03-07 19:34:47 CST,6.42, Home, Home, 
3/8/18, 2018-03-08 01:40:30, 2018-03-07 19:34:47 CST, 2018-03-07 19:40:30 CST,0.1, Transport, , 
3/8/18, 2018-03-08 05:02:04, 2018-03-07 19:40:58 CST, 2018-03-07 23:02:04 CST,3.35, Friends, Melissa’s, 
3/8/18, 2018-03-08 05:07:50, 2018-03-07 23:02:04 CST, 2018-03-07 23:07:50 CST,0.1, Transport, , 
3/8/18, 2018-03-08 15:07:20, 2018-03-07 23:07:50 CST, 2018-03-08 09:07:20 CST,9.99, Home, Home, 
3/8/18, 2018-03-08 12:31:58, 2018-03-07 23:29:20 CST, 2018-03-08 06:31:58 CST,7.04, Sleep, Home, 
3/8/18, 2018-03-08 15:36:45, 2018-03-08 09:07:19 CST, 2018-03-08 09:36:45 CST,0.49, Commute to work, , 
3/8/18, 2018-03-08 15:12:24, 2018-03-08 09:07:20 CST, 2018-03-08 09:12:24 CST,0.08, Transport, , 
3/8/18, 2018-03-08 15:24:46, 2018-03-08 09:19:25 CST, 2018-03-08 09:24:46 CST,0.09, Transport, , 
3/8/18, 2018-03-08 15:36:03, 2018-03-08 09:25:26 CST, 2018-03-08 09:36:03 CST,0.18, Walk, , 
3/8/18, 2018-03-08 16:20:47, 2018-03-08 09:36:45 CST, 2018-03-08 10:20:47 CST,0.73, School, , 
3/8/18, 2018-03-09 00:07:06, 2018-03-08 10:39:44 CST, 2018-03-08 18:07:06 CST,7.46, School, , 
3/9/18, 2018-03-09 00:42:52, 2018-03-08 18:07:05 CST, 2018-03-08 18:42:52 CST,0.6, Commute to home, , 
3/9/18, 2018-03-09 00:42:52, 2018-03-08 18:07:06 CST, 2018-03-08 18:42:52 CST,0.6, Transport, , 
3/9/18, 2018-03-09 01:07:05, 2018-03-08 18:42:52 CST, 2018-03-08 19:07:05 CST,0.4, Home, Home, 
3/9/18, 2018-03-09 01:12:47, 2018-03-08 19:07:05 CST, 2018-03-08 19:12:47 CST,0.1, Walk, , 
3/9/18, 2018-03-09 02:52:44, 2018-03-08 19:13:05 CST, 2018-03-08 20:52:44 CST,1.66, Shopping, Target, 
3/9/18, 2018-03-09 02:59:28, 2018-03-08 20:52:44 CST, 2018-03-08 20:59:28 CST,0.11, Walk, , 
3/9/18, 2018-03-09 11:24:17, 2018-03-08 20:59:29 CST, 2018-03-09 05:24:17 CST,8.41, Work, Home, 
3/9/18, 2018-03-09 10:53:05, 2018-03-09 00:00:11 CST, 2018-03-09 04:53:05 CST,4.88, Sleep, Home, 
3/9/18, 2018-03-09 18:03:29, 2018-03-09 05:25:07 CST, 2018-03-09 12:03:29 CST,6.64, Work, Bagel Art, 
3/9/18, 2018-03-09 20:42:32, 2018-03-09 12:03:29 CST, 2018-03-09 14:42:32 CST,2.65, Home, Home, 
3/9/18, 2018-03-09 21:32:19, 2018-03-09 14:42:32 CST, 2018-03-09 15:32:19 CST,0.83, Transport, , 
3/9/18, 2018-03-10 02:10:41, 2018-03-09 17:25:07 CST, 2018-03-09 20:10:41 CST,2.76, Flight, , 
3/10/18, 2018-03-10 02:30:56, 2018-03-09 21:25:18 EST, 2018-03-09 21:30:56 EST,0.09, Walk, , 
3/10/18, 2018-03-10 13:20:20, 2018-03-09 21:51:06 EST, 2018-03-10 08:20:20 EST,10.49, Flight, , 
3/10/18, 2018-03-10 14:16:16, 2018-03-10 08:55:28 EST, 2018-03-10 09:16:16 EST,0.35, Transport, , 
3/10/18, 2018-03-10 15:55:57, 2018-03-10 10:47:00 EST, 2018-03-10 10:55:57 EST,0.15, Transport, , 
3/10/18, 2018-03-10 16:55:25, 2018-03-10 11:50:13 EST, 2018-03-10 11:55:25 EST,0.09, Transport, , 
3/10/18, 2018-03-10 17:36:15, 2018-03-10 12:30:24 EST, 2018-03-10 12:36:15 EST,0.1, Walk, , 
3/10/18, 2018-03-10 22:05:32, 2018-03-10 17:01:05 EST, 2018-03-10 17:05:32 EST,0.07, Transport, , 
3/11/18, 2018-03-11 01:00:19, 2018-03-10 19:56:27 EST, 2018-03-10 20:00:19 EST,0.06, Transport, , 
3/11/18, 2018-03-11 01:30:17, 2018-03-10 20:18:36 EST, 2018-03-10 20:30:17 EST,0.19, Transport, , 
3/11/18, 2018-03-11 03:37:28, 2018-03-10 22:30:28 EST, 2018-03-10 22:37:28 EST,0.12, Transport, , 
3/11/18, 2018-03-11 12:30:31, 2018-03-11 00:05:43 EST, 2018-03-11 08:30:31 EDT,7.41, Sleep, , 
3/11/18, 2018-03-11 15:59:32, 2018-03-11 11:55:37 EDT, 2018-03-11 11:59:32 EDT,0.07, Transport, , 
3/11/18, 2018-03-11 21:52:31, 2018-03-11 17:49:48 EDT, 2018-03-11 17:52:31 EDT,0.05, Transport, , 
3/12/18, 2018-03-12 02:19:00, 2018-03-11 22:10:46 EDT, 2018-03-11 22:19:00 EDT,0.14, Transport, , 
3/12/18, 2018-03-12 03:35:43, 2018-03-11 23:28:05 EDT, 2018-03-11 23:35:43 EDT,0.13, Transport, , 
3/12/18, 2018-03-12 11:30:37, 2018-03-12 00:15:53 EDT, 2018-03-12 07:30:37 EDT,7.25, Sleep, , 
3/12/18, 2018-03-12 15:31:22, 2018-03-12 11:24:46 EDT, 2018-03-12 11:31:22 EDT,0.11, Transport, , 
3/12/18, 2018-03-12 16:19:36, 2018-03-12 12:12:47 EDT, 2018-03-12 12:19:36 EDT,0.11, Transport, , 
3/12/18, 2018-03-12 19:33:06, 2018-03-12 15:22:37 EDT, 2018-03-12 15:33:06 EDT,0.17, Transport, , 
3/12/18, 2018-03-12 22:13:04, 2018-03-12 18:00:34 EDT, 2018-03-12 18:13:04 EDT,0.21, Transport, , 
3/13/18, 2018-03-13 01:00:56, 2018-03-12 20:49:58 EDT, 2018-03-12 21:00:56 EDT,0.18, Transport, , 
3/13/18, 2018-03-13 01:06:23, 2018-03-12 21:00:56 EDT, 2018-03-12 21:06:23 EDT,0.09, Walk, , 
3/13/18, 2018-03-13 03:54:58, 2018-03-12 23:47:02 EDT, 2018-03-12 23:54:58 EDT,0.13, Transport, , 
3/13/18, 2018-03-13 09:02:51, 2018-03-13 00:24:14 EDT, 2018-03-13 05:02:51 EDT,4.64, Sleep, , 
3/13/18, 2018-03-13 15:49:03, 2018-03-13 11:42:39 EDT, 2018-03-13 11:49:03 EDT,0.11, Transport, , 
3/13/18, 2018-03-13 20:13:58, 2018-03-13 16:07:29 EDT, 2018-03-13 16:13:58 EDT,0.11, Transport, , 
3/14/18, 2018-03-14 02:44:05, 2018-03-13 22:39:37 EDT, 2018-03-13 22:44:05 EDT,0.07, Transport, , 
3/14/18, 2018-03-14 03:14:37, 2018-03-13 23:08:03 EDT, 2018-03-13 23:14:37 EDT,0.11, Transport, , 
3/14/18, 2018-03-14 04:00:03, 2018-03-13 23:40:16 EDT, 2018-03-14 00:00:03 EDT,0.33, Transport, , 
3/14/18, 2018-03-14 11:45:36, 2018-03-14 03:30:48 EDT, 2018-03-14 07:45:36 EDT,4.25, Flight, , 
3/14/18, 2018-03-14 14:21:03, 2018-03-14 09:23:48 GMT-3, 2018-03-14 11:21:03 GMT-3,1.95, Flight, , 
3/14/18, 2018-03-14 16:23:08, 2018-03-14 11:58:19 GMT-3, 2018-03-14 13:23:08 GMT-3,1.41, Transport, , 
3/14/18, 2018-03-14 19:21:19, 2018-03-14 15:56:57 GMT-3, 2018-03-14 16:21:19 GMT-3,0.41, Transport, , 
3/14/18, 2018-03-14 21:24:29, 2018-03-14 18:18:35 GMT-3, 2018-03-14 18:24:29 GMT-3,0.1, Transport, , 
3/14/18, 2018-03-14 23:30:42, 2018-03-14 20:25:29 GMT-3, 2018-03-14 20:30:42 GMT-3,0.09, Transport, , 
3/15/18, 2018-03-15 01:49:21, 2018-03-14 22:39:45 GMT-3, 2018-03-14 22:49:21 GMT-3,0.16, Transport, , 
3/15/18, 2018-03-15 05:03:18, 2018-03-15 01:50:52 GMT-3, 2018-03-15 02:03:18 GMT-3,0.21, Transport, , 
3/15/18, 2018-03-15 10:25:32, 2018-03-15 02:31:35 GMT-3, 2018-03-15 07:25:32 GMT-3,4.9, Sleep, Home, 
3/15/18, 2018-03-15 16:19:49, 2018-03-15 12:48:23 GMT-3, 2018-03-15 13:19:49 GMT-3,0.52, Walk, , 
3/15/18, 2018-03-15 18:54:51, 2018-03-15 15:48:52 GMT-3, 2018-03-15 15:54:51 GMT-3,0.1, Walk, , 
3/15/18, 2018-03-15 20:09:16, 2018-03-15 17:03:08 GMT-3, 2018-03-15 17:09:16 GMT-3,0.1, Walk, , 
3/15/18, 2018-03-15 20:33:19, 2018-03-15 17:10:54 GMT-3, 2018-03-15 17:33:19 GMT-3,0.37, Transport, , 
3/15/18, 2018-03-15 22:55:41, 2018-03-15 19:43:33 GMT-3, 2018-03-15 19:55:41 GMT-3,0.2, Transport, , 
3/15/18, 2018-03-15 23:12:46, 2018-03-15 20:02:30 GMT-3, 2018-03-15 20:12:46 GMT-3,0.17, Transport, , 
3/16/18, 2018-03-16 02:05:17, 2018-03-15 22:37:44 GMT-3, 2018-03-15 23:05:17 GMT-3,0.46, Transport, , 
3/16/18, 2018-03-16 03:32:27, 2018-03-16 00:21:39 GMT-3, 2018-03-16 00:32:27 GMT-3,0.18, Transport, , 
3/16/18, 2018-03-16 10:00:34, 2018-03-16 01:03:51 GMT-3, 2018-03-16 07:00:34 GMT-3,5.95, Sleep, , 
3/16/18, 2018-03-16 12:27:07, 2018-03-16 08:38:01 GMT-3, 2018-03-16 09:27:07 GMT-3,0.82, Transport, , 
3/16/18, 2018-03-16 12:46:05, 2018-03-16 09:43:15 GMT-3, 2018-03-16 09:46:05 GMT-3,0.05, Transport, , 
3/16/18, 2018-03-16 15:43:39, 2018-03-16 12:41:21 GMT-3, 2018-03-16 12:43:39 GMT-3,0.04, Walk, , 
3/16/18, 2018-03-16 15:53:30, 2018-03-16 12:48:28 GMT-3, 2018-03-16 12:53:30 GMT-3,0.08, Transport, , 
3/16/18, 2018-03-16 16:29:48, 2018-03-16 12:53:30 GMT-3, 2018-03-16 13:29:48 GMT-3,0.61, Walk, , 
3/16/18, 2018-03-16 19:35:24, 2018-03-16 16:24:19 GMT-3, 2018-03-16 16:35:24 GMT-3,0.18, Walk, , 
3/16/18, 2018-03-16 21:43:31, 2018-03-16 18:36:39 GMT-3, 2018-03-16 18:43:31 GMT-3,0.11, Walk, , 
3/17/18, 2018-03-17 00:47:20, 2018-03-16 21:36:01 GMT-3, 2018-03-16 21:47:20 GMT-3,0.19, Walk, , 
3/17/18, 2018-03-17 01:34:28, 2018-03-16 22:26:28 GMT-3, 2018-03-16 22:34:28 GMT-3,0.13, Transport, , 
3/17/18, 2018-03-17 01:39:08, 2018-03-16 22:34:28 GMT-3, 2018-03-16 22:39:08 GMT-3,0.08, Walk, , 
3/17/18, 2018-03-17 03:30:49, 2018-03-16 23:00:30 GMT-3, 2018-03-17 00:30:49 GMT-3,1.51, Transport, , 
3/17/18, 2018-03-17 11:30:28, 2018-03-17 01:01:24 GMT-3, 2018-03-17 08:30:28 GMT-3,7.48, Sleep, Home, 
3/17/18, 2018-03-17 15:02:52, 2018-03-17 11:41:04 GMT-3, 2018-03-17 12:02:52 GMT-3,0.36, Transport, , 
3/17/18, 2018-03-17 17:51:16, 2018-03-17 14:44:05 GMT-3, 2018-03-17 14:51:16 GMT-3,0.12, Transport, , 
3/17/18, 2018-03-17 19:10:18, 2018-03-17 15:57:30 GMT-3, 2018-03-17 16:10:18 GMT-3,0.21, Transport, , 
3/17/18, 2018-03-17 21:25:59, 2018-03-17 18:09:07 GMT-3, 2018-03-17 18:25:59 GMT-3,0.28, Transport, , 
3/18/18, 2018-03-18 08:17:37, 2018-03-18 05:06:36 GMT-3, 2018-03-18 05:17:37 GMT-3,0.18, Cycle, , 
3/18/18, 2018-03-18 13:00:27, 2018-03-18 05:19:42 GMT-3, 2018-03-18 10:00:27 GMT-3,4.68, Sleep, Home, 
3/18/18, 2018-03-18 20:30:46, 2018-03-18 16:24:58 GMT-3, 2018-03-18 17:30:46 GMT-3,1.1, Transport, , 
3/18/18, 2018-03-19 08:17:31, 2018-03-18 19:47:23 GMT-3, 2018-03-19 05:17:31 GMT-3,9.5, Flight, , 
3/19/18, 2018-03-19 08:27:33, 2018-03-19 05:17:31 GMT-3, 2018-03-19 05:27:33 GMT-3,0.17, Transport, , 
3/19/18, 2018-03-19 12:19:40, 2018-03-19 08:14:21 EDT, 2018-03-19 08:19:40 EDT,0.09, Walk, , 
3/19/18, 2018-03-19 17:30:34, 2018-03-19 10:22:00 EDT, 2018-03-19 13:30:34 EDT,3.14, Flight, , 
3/19/18, 2018-03-19 17:47:43, 2018-03-19 13:30:34 EDT, 2018-03-19 13:47:43 EDT,0.29, Transport, , 
3/19/18, 2018-03-19 19:06:37, 2018-03-19 13:01:35 CDT, 2018-03-19 14:06:37 CDT,1.08, Transport, , 
3/19/18, 2018-03-20 13:59:35, 2018-03-19 14:06:37 CDT, 2018-03-20 08:59:35 CDT,18.88, Home, Home, 
3/20/18, 2018-03-20 10:27:50, 2018-03-20 01:18:03 CDT, 2018-03-20 05:27:50 CDT,4.16, Sleep, Home, 
3/20/18, 2018-03-20 14:09:20, 2018-03-20 08:59:35 CDT, 2018-03-20 09:09:20 CDT,0.16, Walk, , 
3/20/18, 2018-03-20 14:27:25, 2018-03-20 09:23:37 CDT, 2018-03-20 09:27:25 CDT,0.06, Walk, , 
3/20/18, 2018-03-20 15:04:22, 2018-03-20 09:27:26 CDT, 2018-03-20 10:04:22 CDT,0.62, Groceries, Jewel-Osco, 
3/20/18, 2018-03-21 10:24:00, 2018-03-20 10:05:07 CDT, 2018-03-21 05:24:00 CDT,19.31, Home, Home, 
3/21/18, 2018-03-21 09:55:26, 2018-03-20 22:53:56 CDT, 2018-03-21 04:55:26 CDT,6.03, Sleep, Home, 
3/21/18, 2018-03-21 18:37:28, 2018-03-21 05:24:45 CDT, 2018-03-21 13:37:28 CDT,8.21, Work, Bagel Art, 
3/21/18, 2018-03-21 18:39:52, 2018-03-21 13:37:27 CDT, 2018-03-21 13:39:52 CDT,0.04, Commute to home, , 
3/21/18, 2018-03-22 14:03:19, 2018-03-21 13:39:52 CDT, 2018-03-22 09:03:19 CDT,19.39, Home, Home, 
3/22/18, 2018-03-22 12:17:48, 2018-03-22 02:13:47 CDT, 2018-03-22 07:17:48 CDT,5.07, Sleep, Home, 
3/22/18, 2018-03-22 14:45:20, 2018-03-22 09:03:18 CDT, 2018-03-22 09:45:20 CDT,0.7, Commute to work, , 
3/22/18, 2018-03-22 14:23:02, 2018-03-22 09:05:08 CDT, 2018-03-22 09:23:02 CDT,0.3, Transport, , 
3/22/18, 2018-03-22 14:29:02, 2018-03-22 09:23:02 CDT, 2018-03-22 09:29:02 CDT,0.1, Walk, , 
3/22/18, 2018-03-22 14:45:19, 2018-03-22 09:40:38 CDT, 2018-03-22 09:45:19 CDT,0.08, Walk, , 
3/22/18, 2018-03-22 17:18:29, 2018-03-22 09:45:20 CDT, 2018-03-22 12:18:29 CDT,2.55, School, , 
3/22/18, 2018-03-23 11:25:35, 2018-03-22 18:35:33 CDT, 2018-03-23 06:25:35 CDT,11.83, Work, Home, 
3/23/18, 2018-03-23 10:50:26, 2018-03-22 22:23:17 CDT, 2018-03-23 05:50:26 CDT,7.45, Sleep, Home, 
3/23/18, 2018-03-23 20:23:42, 2018-03-23 06:26:20 CDT, 2018-03-23 15:23:42 CDT,8.96, Work, Bagel Art, 
3/23/18, 2018-03-24 10:23:35, 2018-03-23 15:24:40 CDT, 2018-03-24 05:23:35 CDT,13.98, Home, Home, 
3/24/18, 2018-03-24 09:55:25, 2018-03-24 00:14:11 CDT, 2018-03-24 04:55:25 CDT,4.69, Sleep, Home, 
3/24/18, 2018-03-24 10:24:36, 2018-03-24 05:23:34 CDT, 2018-03-24 05:24:36 CDT,0.02, Commute to work, , 
3/24/18, 2018-03-24 19:40:38, 2018-03-24 05:24:36 CDT, 2018-03-24 14:40:38 CDT,9.27, Work, Bagel Art, 
3/24/18, 2018-03-24 19:42:12, 2018-03-24 14:40:37 CDT, 2018-03-24 14:42:12 CDT,0.03, Commute to home, , 
3/24/18, 2018-03-24 21:42:19, 2018-03-24 14:42:12 CDT, 2018-03-24 16:42:19 CDT,2, Home, Home, 
3/24/18, 2018-03-24 21:49:16, 2018-03-24 16:42:19 CDT, 2018-03-24 16:49:16 CDT,0.12, Walk, , 
3/24/18, 2018-03-24 22:32:47, 2018-03-24 16:49:17 CDT, 2018-03-24 17:32:47 CDT,0.73, Shopping, Target, 
3/24/18, 2018-03-24 23:06:04, 2018-03-24 17:32:48 CDT, 2018-03-24 18:06:04 CDT,0.55, Shopping, Urban Outfitters, 
3/24/18, 2018-03-25 00:26:05, 2018-03-24 18:06:35 CDT, 2018-03-24 19:26:05 CDT,1.33, Friends, Naomi’s, 
3/25/18, 2018-03-25 00:38:38, 2018-03-24 19:26:05 CDT, 2018-03-24 19:38:38 CDT,0.21, Walk, , 
3/25/18, 2018-03-25 11:24:40, 2018-03-24 19:38:39 CDT, 2018-03-25 06:24:40 CDT,10.77, Home, Home, 
3/25/18, 2018-03-25 10:50:23, 2018-03-24 23:07:47 CDT, 2018-03-25 05:50:23 CDT,6.71, Sleep, Home, 
3/25/18, 2018-03-25 15:52:07, 2018-03-25 06:25:25 CDT, 2018-03-25 10:52:07 CDT,4.45, Work, Bagel Art, 
3/25/18, 2018-03-25 15:53:55, 2018-03-25 10:52:06 CDT, 2018-03-25 10:53:55 CDT,0.03, Commute to home, , 
3/25/18, 2018-03-27 00:32:57, 2018-03-25 10:53:55 CDT, 2018-03-26 19:32:57 CDT,32.65, Home, Home, 
3/26/18, 2018-03-26 20:24:31, 2018-03-26 06:19:12 CDT, 2018-03-26 15:24:31 CDT,9.09, Sleep, Home, 
3/27/18, 2018-03-27 00:38:56, 2018-03-26 19:32:57 CDT, 2018-03-26 19:38:56 CDT,0.1, Walk, , 
3/27/18, 2018-03-27 03:19:19, 2018-03-26 19:50:29 CDT, 2018-03-26 22:19:19 CDT,2.48, Friends, Melissa’s, 
3/27/18, 2018-03-27 03:25:18, 2018-03-26 22:19:19 CDT, 2018-03-26 22:25:18 CDT,0.1, Walk, , 
3/27/18, 2018-03-27 13:53:34, 2018-03-26 22:25:19 CDT, 2018-03-27 08:53:34 CDT,10.47, Work, Home, 
3/27/18, 2018-03-27 12:00:30, 2018-03-26 23:02:28 CDT, 2018-03-27 07:00:30 CDT,7.97, Sleep, Home, 
3/27/18, 2018-03-27 14:08:29, 2018-03-27 08:54:24 CDT, 2018-03-27 09:08:29 CDT,0.23, Work, Bagel Art, 
3/27/18, 2018-03-27 14:21:16, 2018-03-27 09:08:29 CDT, 2018-03-27 09:21:16 CDT,0.21, Transport, , 
3/27/18, 2018-03-27 14:32:29, 2018-03-27 09:21:16 CDT, 2018-03-27 09:32:29 CDT,0.19, Walk, , 
3/27/18, 2018-03-27 16:30:11, 2018-03-27 09:32:30 CDT, 2018-03-27 11:30:11 CDT,1.96, School, Oakton Community College, 
3/27/18, 2018-03-27 17:31:23, 2018-03-27 12:24:31 CDT, 2018-03-27 12:31:23 CDT,0.11, School, , 
3/28/18, 2018-03-28 10:25:18, 2018-03-27 21:19:49 CDT, 2018-03-28 05:25:18 CDT,8.09, Work, Home, 
3/28/18, 2018-03-28 09:55:26, 2018-03-28 00:38:33 CDT, 2018-03-28 04:55:26 CDT,4.28, Sleep, Home, 
3/28/18, 2018-03-28 19:08:34, 2018-03-28 05:26:03 CDT, 2018-03-28 14:08:34 CDT,8.71, Work, Bagel Art, 
3/28/18, 2018-03-29 01:14:44, 2018-03-28 14:09:31 CDT, 2018-03-28 20:14:44 CDT,6.09, Home, Home, 
3/29/18, 2018-03-29 01:21:11, 2018-03-28 20:14:44 CDT, 2018-03-28 20:21:11 CDT,0.11, Walk, , 
3/29/18, 2018-03-29 05:29:41, 2018-03-29 00:22:46 CDT, 2018-03-29 00:29:41 CDT,0.12, Walk, , 
3/29/18, 2018-03-29 13:54:33, 2018-03-29 00:29:42 CDT, 2018-03-29 08:54:33 CDT,8.41, Home, Home, 
3/29/18, 2018-03-29 12:10:11, 2018-03-29 00:55:38 CDT, 2018-03-29 07:10:11 CDT,6.24, Sleep, Home, 
3/29/18, 2018-03-29 14:37:56, 2018-03-29 08:54:32 CDT, 2018-03-29 09:37:56 CDT,0.72, Commute to work, , 
3/29/18, 2018-03-29 13:56:49, 2018-03-29 08:54:33 CDT, 2018-03-29 08:56:49 CDT,0.04, Walk, , 
3/29/18, 2018-03-29 14:12:20, 2018-03-29 08:56:50 CDT, 2018-03-29 09:12:20 CDT,0.26, Transport, , 
3/29/18, 2018-03-29 14:28:01, 2018-03-29 09:12:20 CDT, 2018-03-29 09:28:01 CDT,0.26, Walk, , 
3/29/18, 2018-03-29 16:57:43, 2018-03-29 09:37:56 CDT, 2018-03-29 11:57:43 CDT,2.33, School, , 
3/29/18, 2018-03-29 20:00:56, 2018-03-29 14:53:06 CDT, 2018-03-29 15:00:56 CDT,0.13, Transport, , 
3/29/18, 2018-03-29 20:15:18, 2018-03-29 15:11:32 CDT, 2018-03-29 15:15:18 CDT,0.06, Transport, , 
3/29/18, 2018-03-30 12:23:59, 2018-03-29 15:16:50 CDT, 2018-03-30 07:23:59 CDT,16.12, Home, Home, 
3/30/18, 2018-03-30 10:50:29, 2018-03-29 23:56:18 CDT, 2018-03-30 05:50:29 CDT,5.9, Sleep, Home, 
3/30/18, 2018-03-30 20:18:33, 2018-03-30 07:24:37 CDT, 2018-03-30 15:18:33 CDT,7.9, Work, Bagel Art, 
3/30/18, 2018-03-31 00:36:35, 2018-03-30 15:19:21 CDT, 2018-03-30 19:36:35 CDT,4.29, Home, Home, 
3/31/18, 2018-03-31 00:57:27, 2018-03-30 19:36:35 CDT, 2018-03-30 19:57:27 CDT,0.35, Transport, , 
3/31/18, 2018-03-31 04:08:25, 2018-03-30 22:35:50 CDT, 2018-03-30 23:08:25 CDT,0.54, Transport, , 
3/31/18, 2018-03-31 04:11:00, 2018-03-30 23:08:25 CDT, 2018-03-30 23:11:00 CDT,0.04, Walk, , 
3/31/18, 2018-03-31 11:25:43, 2018-03-30 23:11:01 CDT, 2018-03-31 06:25:43 CDT,7.25, Home, Home, 
3/31/18, 2018-03-31 10:50:29, 2018-03-30 23:38:28 CDT, 2018-03-31 05:50:29 CDT,6.2, Sleep, Home, 
3/31/18, 2018-03-31 20:34:54, 2018-03-31 06:26:28 CDT, 2018-03-31 15:34:54 CDT,9.14, Work, Bagel Art, 
3/31/18, 2018-04-01 14:31:08, 2018-03-31 15:35:39 CDT, 2018-04-01 09:31:08 CDT,17.92, Home, Home, 
4/1/18, 2018-04-01 10:29:25, 2018-04-01 01:23:07 CDT, 2018-04-01 05:29:25 CDT,4.11, Sleep, Home, 
4/1/18, 2018-04-01 15:38:12, 2018-04-01 09:31:08 CDT, 2018-04-01 10:38:12 CDT,1.12, Home, Home, 
4/1/18, 2018-04-01 15:56:16, 2018-04-01 10:38:12 CDT, 2018-04-01 10:56:16 CDT,0.3, Walk, , 
4/1/18, 2018-04-02 00:03:10, 2018-04-01 10:56:17 CDT, 2018-04-01 19:03:10 CDT,8.11, Friends, Melissa’s, 
4/2/18, 2018-04-02 00:15:45, 2018-04-01 19:03:10 CDT, 2018-04-01 19:15:45 CDT,0.21, Walk, , 
4/2/18, 2018-04-03 13:47:28, 2018-04-01 19:15:50 CDT, 2018-04-03 08:47:28 CDT,37.53, Home, Home, 
4/2/18, 2018-04-02 09:55:23, 2018-04-01 22:32:03 CDT, 2018-04-02 04:55:23 CDT,6.39, Sleep, Home, 
4/3/18, 2018-04-03 11:19:16, 2018-04-02 23:43:21 CDT, 2018-04-03 06:19:16 CDT,6.6, Sleep, Home, 
4/3/18, 2018-04-03 14:02:06, 2018-04-03 08:47:28 CDT, 2018-04-03 09:02:06 CDT,0.24, Transport, , 
4/3/18, 2018-04-03 14:05:32, 2018-04-03 09:02:06 CDT, 2018-04-03 09:05:32 CDT,0.06, Walk, , 
4/3/18, 2018-04-03 14:28:06, 2018-04-03 09:23:33 CDT, 2018-04-03 09:28:06 CDT,0.08, Walk, , 
4/3/18, 2018-04-03 19:19:18, 2018-04-03 14:13:52 CDT, 2018-04-03 14:19:18 CDT,0.09, Transport, , 
4/3/18, 2018-04-03 19:33:20, 2018-04-03 14:27:57 CDT, 2018-04-03 14:33:20 CDT,0.09, Transport, , 
4/3/18, 2018-04-03 21:05:41, 2018-04-03 14:33:36 CDT, 2018-04-03 16:05:41 CDT,1.53, Home, Home, 
4/3/18, 2018-04-03 21:27:07, 2018-04-03 16:05:40 CDT, 2018-04-03 16:27:07 CDT,0.36, Commute to work, , 
4/3/18, 2018-04-03 21:21:44, 2018-04-03 16:05:41 CDT, 2018-04-03 16:21:44 CDT,0.27, Transport, , 
4/3/18, 2018-04-03 21:27:06, 2018-04-03 16:21:44 CDT, 2018-04-03 16:27:06 CDT,0.09, Walk, , 
4/3/18, 2018-04-04 01:36:25, 2018-04-03 16:27:07 CDT, 2018-04-03 20:36:25 CDT,4.16, School, , 
4/4/18, 2018-04-04 01:50:29, 2018-04-03 20:36:25 CDT, 2018-04-03 20:50:29 CDT,0.23, Transport, , 
4/4/18, 2018-04-04 10:27:22, 2018-04-03 20:50:29 CDT, 2018-04-04 05:27:22 CDT,8.61, Work, Home, 
4/4/18, 2018-04-04 10:00:23, 2018-04-04 00:10:01 CDT, 2018-04-04 05:00:23 CDT,4.84, Sleep, Home, 
4/4/18, 2018-04-04 16:53:20, 2018-04-04 05:28:11 CDT, 2018-04-04 11:53:20 CDT,6.42, Work, Bagel Art, 
4/4/18, 2018-04-04 16:54:48, 2018-04-04 11:53:19 CDT, 2018-04-04 11:54:48 CDT,0.02, Commute to home, , 
4/4/18, 2018-04-05 13:55:28, 2018-04-04 11:54:48 CDT, 2018-04-05 08:55:28 CDT,21.01, Work, Home, 
4/5/18, 2018-04-05 11:25:25, 2018-04-04 22:18:45 CDT, 2018-04-05 06:25:25 CDT,8.11, Sleep, Home, 
4/5/18, 2018-04-05 14:07:22, 2018-04-05 08:55:39 CDT, 2018-04-05 09:07:22 CDT,0.2, Work, Bagel Art, 
4/5/18, 2018-04-05 14:11:21, 2018-04-05 09:07:22 CDT, 2018-04-05 09:11:21 CDT,0.07, Transport, , 
4/5/18, 2018-04-05 14:21:18, 2018-04-05 09:17:50 CDT, 2018-04-05 09:21:18 CDT,0.06, Transport, , 
4/5/18, 2018-04-05 14:28:32, 2018-04-05 09:22:01 CDT, 2018-04-05 09:28:32 CDT,0.11, Walk, , 
4/5/18, 2018-04-05 15:12:15, 2018-04-05 10:00:08 CDT, 2018-04-05 10:12:15 CDT,0.2, School, , 
4/5/18, 2018-04-06 03:45:27, 2018-04-05 10:12:21 CDT, 2018-04-05 22:45:27 CDT,12.55, School, , 
4/6/18, 2018-04-06 11:24:39, 2018-04-05 22:45:27 CDT, 2018-04-06 06:24:39 CDT,7.65, Work, Home, 
4/6/18, 2018-04-06 10:26:02, 2018-04-05 23:14:40 CDT, 2018-04-06 05:26:02 CDT,6.19, Sleep, Home, 
4/6/18, 2018-04-06 19:09:32, 2018-04-06 06:25:37 CDT, 2018-04-06 14:09:32 CDT,7.73, Work, Bagel Art, 
4/6/18, 2018-04-06 19:18:54, 2018-04-06 14:09:32 CDT, 2018-04-06 14:18:54 CDT,0.16, Walk, , 
4/6/18, 2018-04-07 21:27:38, 2018-04-06 14:24:56 CDT, 2018-04-07 16:27:38 CDT,26.05, Work, Bagel Art, 
4/7/18, 2018-04-07 10:44:23, 2018-04-06 21:49:53 CDT, 2018-04-07 05:44:23 CDT,7.91, Sleep, Bagel Art, 
4/7/18, 2018-04-07 21:34:03, 2018-04-07 16:27:38 CDT, 2018-04-07 16:34:03 CDT,0.11, Home, Home, 
4/7/18, 2018-04-07 21:36:47, 2018-04-07 16:34:03 CDT, 2018-04-07 16:36:47 CDT,0.05, Walk, , 
4/7/18, 2018-04-07 22:14:00, 2018-04-07 16:36:48 CDT, 2018-04-07 17:14:00 CDT,0.62, Transport, , 
4/7/18, 2018-04-07 22:22:46, 2018-04-07 17:17:04 CDT, 2018-04-07 17:22:46 CDT,0.1, Walk, , 
4/7/18, 2018-04-07 22:59:40, 2018-04-07 17:48:14 CDT, 2018-04-07 17:59:40 CDT,0.19, Walk, , 
4/7/18, 2018-04-07 23:32:06, 2018-04-07 17:59:41 CDT, 2018-04-07 18:32:06 CDT,0.54, Transport, , 
4/7/18, 2018-04-08 06:12:21, 2018-04-07 18:32:06 CDT, 2018-04-08 01:12:21 CDT,6.67, Home, Home, 
4/8/18, 2018-04-08 10:50:06, 2018-04-08 00:16:01 CDT, 2018-04-08 05:50:06 CDT,5.57, Sleep, , 
4/8/18, 2018-04-08 11:27:31, 2018-04-08 06:22:32 CDT, 2018-04-08 06:27:31 CDT,0.08, Walk, , 
4/8/18, 2018-04-08 15:44:13, 2018-04-08 10:37:09 CDT, 2018-04-08 10:44:13 CDT,0.12, Walk, , 
4/8/18, 2018-04-08 16:42:26, 2018-04-08 11:14:25 CDT, 2018-04-08 11:42:26 CDT,0.47, Walk, , 
4/8/18, 2018-04-08 17:00:30, 2018-04-08 11:48:07 CDT, 2018-04-08 12:00:30 CDT,0.21, Walk, , 
4/8/18, 2018-04-08 17:38:25, 2018-04-08 12:28:45 CDT, 2018-04-08 12:38:25 CDT,0.16, Walk, , 
4/8/18, 2018-04-08 17:50:04, 2018-04-08 12:41:41 CDT, 2018-04-08 12:50:04 CDT,0.14, Walk, , 
4/8/18, 2018-04-08 19:56:53, 2018-04-08 14:29:10 CDT, 2018-04-08 14:56:53 CDT,0.46, Walk, , 
4/9/18, 2018-04-09 10:01:03, 2018-04-08 23:48:12 CDT, 2018-04-09 05:01:03 CDT,5.21, Sleep, , 
4/9/18, 2018-04-09 10:50:38, 2018-04-09 05:42:17 CDT, 2018-04-09 05:50:38 CDT,0.14, Walk, , 
4/9/18, 2018-04-09 11:14:48, 2018-04-09 05:58:29 CDT, 2018-04-09 06:14:48 CDT,0.27, Walk, , 
4/9/18, 2018-04-09 12:27:09, 2018-04-09 07:13:21 CDT, 2018-04-09 07:27:09 CDT,0.23, Walk, , 
4/9/18, 2018-04-09 12:52:11, 2018-04-09 07:45:46 CDT, 2018-04-09 07:52:11 CDT,0.11, Walk, , 
4/9/18, 2018-04-09 13:15:09, 2018-04-09 08:05:16 CDT, 2018-04-09 08:15:09 CDT,0.16, Walk, , 
4/9/18, 2018-04-09 13:49:00, 2018-04-09 08:39:29 CDT, 2018-04-09 08:49:00 CDT,0.16, Walk, , 
4/9/18, 2018-04-09 14:30:02, 2018-04-09 09:15:31 CDT, 2018-04-09 09:30:02 CDT,0.24, Walk, , 
4/9/18, 2018-04-09 14:47:47, 2018-04-09 09:38:19 CDT, 2018-04-09 09:47:47 CDT,0.16, Walk, , 
4/9/18, 2018-04-09 15:21:51, 2018-04-09 10:16:18 CDT, 2018-04-09 10:21:51 CDT,0.09, Walk, , 
4/9/18, 2018-04-10 12:16:36, 2018-04-09 14:22:49 CDT, 2018-04-10 07:16:36 CDT,16.9, Home, Home, 
4/10/18, 2018-04-10 11:30:10, 2018-04-09 23:22:59 CDT, 2018-04-10 06:30:10 CDT,7.12, Sleep, Home, 
4/10/18, 2018-04-10 13:57:04, 2018-04-10 07:16:36 CDT, 2018-04-10 08:57:04 CDT,1.67, Home, Home, 
4/10/18, 2018-04-10 14:27:43, 2018-04-10 08:57:03 CDT, 2018-04-10 09:27:43 CDT,0.51, Commute to work, , 
4/10/18, 2018-04-10 14:11:50, 2018-04-10 08:57:04 CDT, 2018-04-10 09:11:50 CDT,0.25, Transport, , 
4/10/18, 2018-04-10 14:27:07, 2018-04-10 09:11:50 CDT, 2018-04-10 09:27:07 CDT,0.25, Walk, , 
4/10/18, 2018-04-10 15:44:42, 2018-04-10 09:27:43 CDT, 2018-04-10 10:44:42 CDT,1.28, School, , 
4/10/18, 2018-04-10 16:18:04, 2018-04-10 10:45:08 CDT, 2018-04-10 11:18:04 CDT,0.55, School, , 
4/10/18, 2018-04-11 02:56:05, 2018-04-10 11:34:56 CDT, 2018-04-10 21:56:05 CDT,10.35, School, Oakton Community College, 
4/11/18, 2018-04-11 20:58:43, 2018-04-10 21:56:05 CDT, 2018-04-11 15:58:43 CDT,18.04, Work, Home, 
4/11/18, 2018-04-11 09:55:09, 2018-04-10 22:31:54 CDT, 2018-04-11 04:55:09 CDT,6.39, Sleep, Home, 
4/11/18, 2018-04-11 21:43:07, 2018-04-11 15:58:43 CDT, 2018-04-11 16:43:07 CDT,0.74, Walk, , 
4/11/18, 2018-04-11 23:13:38, 2018-04-11 17:29:18 CDT, 2018-04-11 18:13:38 CDT,0.74, Walk, , 
4/11/18, 2018-04-12 13:56:41, 2018-04-11 18:13:39 CDT, 2018-04-12 08:56:41 CDT,14.72, Home, Home, 
